"Book_ID","Title","Release_Date","Location"
30658888173,The Mind's I: Fantasies And Reflections On Self And Soul,,???
30658939704,The Thief of Thoth / And Others Shall be Born (Belmont Double),1968,???
30659067109,The Million Cities,1963,???
30659067116,The Hounds of Skaith (Eric John Stark #2),1974,???
30659068080,Men Against the Stars,1963,???
30659099425,Drakula's Brood,,???
30659362866,The Book of Lost Tales: Part One (1) (History of Middle-earth),,???
30659371327,Great Expectations (Wordsworth Classics),,???
30659567332,The Age of Fable,1966,???
30659660432,Bulfinchs Mythology the Age of Fable (The Programmed Classics),,???
30659660996,A Christmas Carol,,???
30659966751,Danefæ. Skatte fra den danske muld. Til Hendes Majestæt Dronning Margrethe 2.,,???
30660094909,The devil's dictionary,,???
30660114636,Emma (Oxford World's Classics),,???
30660191080,COMET: July 1941,1941,???
30660208730,Tarzan and the Castaways (Tarzan #24),1977,???
30660235917,Three Times Infinity: Lorelei of the Red Mist / The Golden Helix / Destination Moon (Gold Medal # s726 );.,1958,???
30660320655,A Tale of Two Cities (SparkNotes Literature Guide) (SparkNotes Literature Guide Series),,???
30660326189,Conan of the Isles (Conan #12),,???
30660334946,A Tale of Two Cities (SparkNotes Literature Guide) (SparkNotes Literature Guide Series),,???
30660731666,They took their stand;: The founders of the Confederacy,,???
30660746851,All Through the Week with Cat and Dog (Learn to Read Fun and Fantasy),,???
30660759304,Pride and Prejudice (The World's Classics),,???
30660759432,"Leaves of Grass: Authoritative Texts, Prefaces, Whitman on His Art, Criticism (Norton Critical Edition)",,???
30660762082,Swordsmen in the Sky (Ace #79276),,???
30660800011,Egyptian Magic,,???
30660923527,Saint Ignatius and the Company of Jesus,,???
30660957536,Bulfinch's Mythology: The Age of Fable; The Age of Chivalry; Legends of Charlema,,???
30661074493,Great Expectations (Tor Classics),,???
30661074755,The Doom That Came to Sarnath,,???
30661087379,Emily Dickinson (Everyman's Poetry),,???
30661340620,"La Doctrine secrÃ te, synthÃ se de la science, de la religion et de la philosophie, par H. P. Blavatsky. 3e Ã dition, revue et corrigÃ e. CosmogenÃ se. DeuxiÃ me partie. Evolution du symbolisme. TroisiÃ me partie. Science occulte et Science moderne. -An",,???
30661426232,A Christmas Carol,,???
30661429025,The Gold of the Gods,,???
30661429534,A Christmas Carol,,???
30661430004,The Cocktail Party,,???
30661430307,Conan Of the Isles,,???
30661431097,Conan The Wanderer,,???
30661432158,The Year's Best Fantasy Stories: 3 (Year's Best Fantasy),,???
30661433448,"The Dwellers on the Nile: The Life, History, Religion and Literature of the Ancient Egyptians",,???
30661438142,The Gold of the Gods,,???
30661450904,"La Guerra De Los Mundos / the War of the Worlds (Millennium, Las 100 Joyas Del Milenio, 42) (Spanish Edition)",,???
30661453910,Life Of Our Lord,,???
30661483384,Terror by Night (Wordsworth Mystery & Supernatural) (Tales of Mystery & the Supernatural),,???
30661486066,Tarzan of the Apes,,???
30661508762,"The Starmen of Llyrdis (aka The Starmen, and as The Galactic Breed)",1976,???
30661510496,The Long Tomorrow,1974,???
30661512364,The Coming of the Terrans,1967,???
30661515150,The Sword of Rhiannon,1967,???
30661516952,The Halfling and Other Stories,1973,???
30661516953,The Long Tomorrow,1962,???
30661516954,The Big Jump,1967,???
30661828839,Mansfield Park (Enriched Classics),,???
30661852755,The Scarlet Letter,,???
30661878117,A Christmas Carol By Charles Dickens (Complete and Unabridged),,???
30661879260,"The Dwellers on the Nile: The Life, History, Religion and Literature of the Ancient Egyptians",,???
30661886492,Thongor in the City of Magicians (Warner 94-208),1979,???
30661888362,Thongor at the End of Time,1979,???
30661900282,The Great Cryptogram: Francis Bacon's Cipher in the So-Called Shakespeare Plays.,,???
30661976960,The Big Four (Hercule Poirot Mysteries),,???
30662078309,The Devil's Dictionary,1958,???
30662079143,Sky Pirates of Callisto #8050,1973,???
30662094145,The Sardonic Humor of Ambrose Bierce,1963,???
30662101778,Tarzan and the Castaways,,???
30662106251,Conan Of the Isles,,???
30662157821,Beyond the Farthest Star,1979,???
30662173987,Final Harvest: Emily Dickinson's Poems,,???
30662178710,Final Harvest: Emily Dickinson's Poems,,???
30662194950,The Mastermind of Mars (Ace SF Classic F-181),1962,???
30662211120,THE BEASTS OF TARZAN,1978,???
30662281481,"Three Times Infinity: Original Gold Medal Collection of Novelettes: Lorelei of the Red Mist (Ray Bradbury & Leigh Brackett), The Golden Helix (Theodore Sturgeon) & Destination Moon (Robert Heinlein)",1963,???
30662306246,The Beasts of Tarzan,1975,???
30662327916,"Go Down, Moses (Modern Library, 175.4)",1955,???
30662352921,Ethiopian Magical Names Of God And Their,,???
30662356042,Ethiopian Magical Names Of God And Their,,???
30662358674,Evil Under the Sun,1970,???
30662454240,Racconti da incubo (Book),,???
30662506292,Classic Readings in Urban Planning: An Introduction,,???
30662513760,The Original Illustrated Sherlock Holmes,1976,???
30662563944,The Egyptian Book of the Dead: The Papyrus of Ani in the British Museum,1967,???
30662621905,Postern Of Faith,,???
30662650258,A Cynic Looks at Life,,???
30662679638,Space Time & Crime,1968,???
30662759031,"The Shaping of Middle-Earth: The Quenta, the Ambarkanta and the Annals (The History of Middle-Earth, Vol. 4)",,???
30662762559,Concord Rebel: A Life of Henry D. Thoreau,,???
30662763151,Nemesis,,???
30662763724,The Mabinogion (Dover Thrift Editions),,???
30662763775,Spark Notes. Now Updated!: A Tale of Two Cities,,???
30662766753,Persuasion (Barnes & Noble Classics),,???
30662797376,Emerson Our Contemporary,1970,???
30662833572,The Great Cryptogram Francis Bacon's Cipher in the So-Called Shakespeare Plays,1888,???
30662963839,Bolts of Melody; New Poems of Emily Dickinson,1945,???
30662965991,"Government by the People: Guide to National, State, and Local Edition",,???
30663003748,The Gods of Mars & The Warlord of Mars (Barsoom Series),,???
30663009853,Complete poemsof Emily Dickinson,1960,???
30663015124,The Age of Fable Or The Beauties of Mythology,1942,???
30663069719,The Mummy,1974,???
30663106817,Bulfinch's Mythology,1978,???
30663162020,A Princess of Mars,1963,???
30663202795,Recuerdos Del Futuro/ Chariots Of The Gods,,???
30663208990,Recuerdos Del Futuro/ Chariots Of The Gods,,???
30663306778,The Original Illustrated Sherlock Holmes,,???
30663316237,Recuerdos Del Futuro/ Chariots Of The Gods,,???
30663320701,Night's Yawning Peal (Abridged Edition),1974,???
30663322454,And Then There Were None : A Novel,,???
30663351563,Selected Poems of Emily Dickinson,,???
30663390556,Great Expectations,,???
30663391324,Recuerdos Del Futuro/ Chariots Of The Gods,,???
30663393412,Great Expectations,,???
30663429107,Destruction of Atlantis: Ragnarok: Age of Fire and Gravel,1974,???
30663434707,"Sherlock Holmes. Le signe des quatre, volume 8 Doyle, Arthur Conan",,???
30663600191,The Master Mind of Mars,1979,???
30663605172,The case book of Sherlock Holmes,1964,???
30663607141,Hickory Dickory Death,1975,???
30663642375,The Waste Land and Other Poems,1955,???
30663647828,Detection by Gaslight: 14 Victorian Detective Stories (Dover Thrift Editions),,???
30663651446,Myths to Live By,,???
30663658480,The Adventures of Sherlock Holmes (Sherlock Holmes Mysteries (Penguin)),,???
30663721506,Egyptian Language Easy Lessons in Egyptian Hieroglyphics,,???
30663723126,Tarzan of the Apes,1975,???
30663797167,Isis Unveiled: a Master Key to the Mysteries of Ancient and Modern Science and Theology; Volume 1,1972,???
30663898876,Thorkil Kristensen. En ener i dansk politik.,,???
30663902538,Danmarkshistorien. Stenalderen. 1-2.,,???
30663995331,Creatures on the Loose # 12,,???
30663995706,"Golden Cities, Far",1970,???
30663998837,Pride and Prejudice (The Penguin English Library),,???
30664001973,"The Best of Planet Stories, No. 1: Strange Adventures on Other Worlds",,???
30664002712,Nemesis,,???
30664002866,The Sherlock Holmes Mysteries,,???
30664004602,The Pickwick Papers (Classics),,???
30664104772,The Complete Poems of Emily Dickinson,1976,???
30664196213,As the Green Star Rises,,???
30664216544,A Tale of Two Cities (Penguin English Library),,???
30664216573,Shadows of Death: Terrifying Tales by H. P. Lovecraft,,???
30664222117,Pride and Prejudice (Collins Classics),,???
30664226852,Sherlock Holmes and the Adventure of Black Peter: Case 11 (On the Case with Holmes and Watson),,???
30664240926,The Hound of the Baskervilles (Townsend Library Edition),,???
30664413569,"Isis Unveiled: Collected Writings, 1877 Blavatsky, Helena Petrovna",1972,???
30664447777,The Return of Tarzan (Tarzan #2),,???
30664514078,Pride and Prejudice,,???
30664518292,The Complete Guide to Mysterious Beings,,???
30664555996,HARRIGAN'S FILE,1975,???
30664633613,An August Derleth Reader,,???
30664638427,The Monk and the Hangman's Daughter. Trans. by Gustav Adolf Danziger. Adapted by Ambrose Bierce. Introd. by Maurice Valency.,1967,???
30664816186,"Devil's Dictionary, The",1910,???
30664824365,"Scandinavia, Ancient and Modern; Being a History of Denmark, Sweden, and Norwway 2 VOLUME SET",1860,???
30664854064,A Tale of Two Cities (Barnes Noble Classics),,???
30664888260,"1935 Official Short Wave Radio Manual [Reproduction]",,???
30664938152,The Book of Skaith: The Adventures of Eric John Stark,1976,???
30664943900,Mansfield Park (Barnes Noble Classics Series),,???
30665004257,A Book of Myths,,???
30665007865,Destination: Saturn; Invader on My Back (Ace Double H-85),,???
30665044822,Bulfinch's Mythology Vols. 2&3,,???
30665046726,Bulfinch's Mythology : The Age of Fable,,???
30665066187,"FANTASTIC Science Fiction & Fantasy Stories: September, Sept. 1974 ('Will-o-the-Wisp')",1974,???
30665096960,Easy Lessons in Egyptian Hieroglyphics : Easy Lessons in Egyptian Hieroglyphics,,???
30665131907,And Then There Were None : A Novel,,???
30665137644,Tarzan and the Golden Lion #9,1979,???
30665137886,Under the Green Star,1972,???
30665137887,As the Green Star Rises,1975,???
30665138860,When the Green Star Calls,1973,???
30665152208,As the Green Star Rises,1975,???
30665344587,What Mrs. McGillicudy Saw (Jane Marple Mysteries),,???
30665391979,"Mysterious Adventures of Sherlock Holmes, The",1920,???
30665505974,A Princess of Mars,1973,???
30665536894,Le Masque de Cthulhu,1975,???
30665650075,The Hound Of The Baskervilles,1959,???
30665740719,Lost on Venus: (#2) (Venus No 2),,???
30665742486,"Tarzan the Untamed (Tarzan #7) (Vintage Ballantine, F751)",,???
30665746868,Pride and Prejudice (Arcturus Paperback Classics),,???
30665747103,The lost continent (Adult fantasy),,???
30665747424,Silent Spring,,???
30665753460,Persuasion (Signet Classics),,???
30665755067,The Cocktail Party,,???
30665756336,Postern of Fate,,???
30665781662,The Reminiscences of Solar Pons (#5),1961,???
30665782499,The Reminiscences of Solar Pons (#5),1961,???
30665784377,The Reminiscences of Solar Pons (#5),1961,???
30665796707,Great Short Stories of the World,,???
30665810940,Selected Poems & Letters of Emily Dickinson,1959,???
30665812695,THE MOON MEN,1975,???
30665818150,Lost on Venus Ace # 49500,1935,???
30665833368,A PRAED STREET DOSSIER,1968,???
30665862953,"Isis Unveiled: Collected Writings, 1877",1972,???
30665864208,Collected Poems of Emily Dickinson,,???
30665880149,Conan of Aquilonia #11,1977,???
30665924392,THE POEMS OF EMILY DICKINSON. Edited by Martha Dickinson Bianchi and Alfred Leete Hampson. Introduction by Alfred Leete Hampson.,1944,???
30665976502,The Cocktail Party,1964,???
30665982159,Selected Poems,1967,???
30665995676,Tarzan and the Lion Man,1974,???
30666002299,The Charwoman's Shadow,1977,???
30666004061,Tarzan and the Lion Man (Tarzan Series #17),1975,???
30666012724,Selected Poems & Letters of Emily Dickinson,1959,???
30666029271,"Selected Shorter Writings of Mark Twain (Riverside Editions, A58)",1974,???
30666030134,Uncollected Stories of William Faulkner,1979,???
30666043834,"18 Best Stories by Edgar Allan Poe",1965,???
30666176752,The Katzenjammer Kids: Early Strips in Full Color.,1974,???
30666177659,"Three Martian Novels : Thuvia Maid of Mars, The Chessmen of Mars, The Master Mind of Mars",1970,???
30666220920,Death of a Salesman,1958,???
30666229090,"Wisconsin, (States of the Nation)",,???
30666270525,The Year's (Years) Best Fantasy Stories: 3,1977,???
30666271560,Flashing Swords! # 1,1973,???
30666348889,CliffsNotes Pride and Prejudice,1959,???
30666356668,CliffsNotes Pride and Prejudice,1959,???
30666367225,The complete old English sheepdog,1976,???
30666502790,Light in August,1972,???
30666518042,CliffsNotes Pride and Prejudice,1959,???
30666540443,The Essential Dickinson,,???
30666564546,Favorite Poems of Emily Dickinson,,???
30666611403,Hallowe'en Party,,???
30666661251,The Year's Best Fantasy Stories,1977,???
30666768890,THE GINGER STAR,1979,???
30666802895,Tarzan And The Castaways,1965,???
30666886496,"Emerson, Our Contemporary",,???
30666949187,The Devil's Dictionary,1958,???
30666983668,The Black Wheel,,???
30666997931,no good from a corpse,1964,???
30667005728,Selected Poems Letters of Emily Dickinson,1959,???
30667080646,The A. B. C. Murders (A Hercule Poirot Novel),,???
30667085532,Flare,,???
30667088339,Northanger Abbey (Signet Classics),,???
30667094559,Lost Continent (Beyond Thirty),,???
30667097168,The Watchers Out of Time (Masters of Horror),,???
30667245722,"Weird Tales Vol. 45, No. 3 (July, 1953)",1953,???
30667261121,The Gods of Mars; Mars 2,,???
30667313762,Elephants Can Remember,1976,???
30667320227,Pirates of Venus,1979,???
30667320412,Tarzan of the Apes,1975,???
30667349910,The Reavers of Skaith,1976,???
30667361012,Greatest Adventures of Sherlock Holmes (Fall River Classics),,???
30667361573,The Nemesis of Evil,1978,???
30667372039,David Copperfield (Wordsworth Classics),,???
30667374409,King Arthur and the Knights of the Round Table-Treasury of Illustrated Classics Storybook Collection,,???
30667375067,King Arthur and the Knights of the Round Table-Treasury of Illustrated Classics Storybook Collection,,???
30667376511,King Arthur and the Knights of the Round Table-Treasury of Illustrated Classics Storybook Collection,,???
30667379115,The Collected Poems of Emily Dickinson (Barnes & Noble Classics Series),,???
30667386528,Tolkien: A Look Behind 'The Lord of the Rings',1975,???
30667393263,Tolkien: A Look Behind the Lord of the Rings,1976,???
30667595891,Final Harvest: Poems,1964,???
30667596044,Final Harvest: Poems,1964,???
30667600584,Selected Poems & Letters of Emily Dickinson,1959,???
30667604154,Selected Poems & Letters of Emily Dickinson,1959,???
30667604905,Final Harvest: Poems,1964,???
30667605177,Final Harvest: Poems,1964,???
30667605975,Final Harvest: Poems,1964,???
30667607147,Selected Poems & Letters of Emily Dickinson,1959,???
30667682165,Persuasion,1964,???
30667727016,People of the Talisman and the Secret of Sinharat,1964,???
30667736899,Music Lovers' Encyclopedia,,???
30667877562,Final Harvest: Poems,,???
30667882603,Ordeal by Innocence,1979,???
30667925403,The Food of Death: Fifty-One Tales,1974,???
30667951652,The Complete Sherlock Holmes (Volume One),,???
30667988256,"Poems, First and Second Series",1948,???
30667993540,Pride and Prejudice (Arcturus Paperback Classics),,???
30668111239,The Great Adventures of Sherlock Holmes (Puffin Classics),,???
30668127832,"Isis Unveiled : Secrets of the Ancient Wisdom Tradition, Madame Blavatsky's First Work",,???
30668197192,"Isis Unveiled : Secrets of the Ancient Wisdom Tradition, Madame Blavatsky's First Work",,???
30668217244,TIME TO COME,1969,???
30668224116,The Collected Poems of Emily Dickinson,,???
30668243178,The D. Case: Or The Truth About The Mystery Of Edwin Drood,,???
30668244273,Civil War Poetry and Prose (Dover Thrift Editions),,???
30668279810,Tarzan and the Castaways,1975,???
30668294381,Tarzan at the Earth's Core,1975,???
30668298328,Tarzan # 12 -- Tarzan and the Lost Empire,1974,???
30668426902,UNA MARTIR DEL SIGLO XIX,,???
30668746096,Emma (Signet Classics),,???
30668751743,My Dear Cassandra : Selections from the Letters of Jane Austen (The Illustrated Letters),,???
30669016042,Selected Poems & Letters of Emily Dickinson,1959,???
30669018898,Conan the Swordsman,1978,???
30669019502,Postern of Fate,1974,???
30669019537,Death In the Air,1977,???
30669020494,The Sign of the Four,1979,???
30669021289,Tolkien: A Look Behind 'The Lord of the Rings,1975,???
30669024311,Tarzan and the Jewels of Opar,1975,???
30669026158,The Adventures of Sherlock Holmes,1976,???
30669028875,Tarzan and the Ant Men,1979,???
30669033753,The Memoirs of Sherlock Holmes,1976,???
30669034390,His Last Bow,1974,???
30669036419,Postern of Fate,1974,???
30669036499,The Hounds of Skaith,1974,???
30669037937,"TARZAN OF THE APES (TARZAN, NO 1)",1974,???
30669038227,Adventures of Sherlock Holmes,1960,???
30669039982,Tolkien: A Look Behind 'The Lord of the Rings,1975,???
30669040040,A Study in Scarlet and The Sign of the Four,1978,???
30669079387,Seven Dials Mystery,1976,???
30669080336,Remembered Death,1973,???
30669081137,Curtain,1979,???
30669081712,Adventures of Sherlock Holmes,1975,???
30669082820,"TARZAN OF THE APES (TARZAN, NO 1)",1974,???
30669083911,The Hounds of Skaith (Vol. 2 of The Book of Skaith),1979,???
30669088235,The Warlord of Mars,1973,???
30669088966,Adventures of Sherlock Holmes,1975,???
30669090138,Bulfinch's Mythology: The Age of Chivalry and the Legends of Charlemagne,1962,???
30669095261,"BULFINCHS MYTHOLOGY (with THE AGE OF FABLE, THE AGE OF CHIVALRY & LEGENDS OF CHARLEMAGNE)",,???
30669248177,"Mythology: The age of fable;: Or, Stories of gods and heroes;",,???
30669262406,The Age of Fable Or The Beauties of Mythology,1942,???
30669611792,Le Masque de Cthulhu,1975,???
30669617971,"POSTERN OF FATE ~ by AGATHA CHRISTIE (hardcover) DODD, MEAD & COMPANY",,???
30669677244,Sleeping Murder & The Murder at the Vicarage,,???
30669690974,"Mythology Bulfinch, Thomas",1973,???
30669697251,Death of a Salesman (Penguin Plays),1976,???
30669701328,A View from the Bridge: A Play in Two Acts,1960,???
30669702994,Bulfinch's Mythology,1978,???
30669731307,Enchantress of World's End (Gondwane Epic #2) (Daw UY1172),1975,???
30669789444,Acts of Light,,???
30669793783,Oliver Twist (Classic Starts),,???
30669902004,The Hounds of Skaith,1974,???
30669913770,LLANA OF GATHOL (Mars #10),1974,???
30669919947,Ragnarok: The Age of Fire and Gravel,,???
30669932742,Elephants Can Remember,,???
30669944376,Bulfinch's Mythology: The Age of Fable / The Legends of Charlemagne / The Age of Chivalry (Laurel Classic),1967,???
30669944789,The Starmen of Llyrdis,1975,???
30669949404,Bulfinch's Mythology: The Age of Fable / The Legends of Charlemagne / The Age of Chivalry (Laurel Classic),1967,???
30670159069,From the Caves and Jungles of Hindostan,,???
30670316172,Vettius and His Friends,,???
30670317291,The Sense and Sensibility Screenplay & Diaries: Bringing Jane Austen's Novel to Film (Newmarket Pictorial Moviebooks),,???
30670470213,From the Caves and Jungles of Hindostan,,???
30670480995,The Book of Skaith: The Adventures of Eric John Stark,1976,???
30671262975,THE BEST OF PLANET STORIES 1,1975,???
30671304729,"Ginger Star (Sphere science fiction) Brackett, Leigh",1976,???
30671312909,The Waste Land and Other Poems,1955,???
30671314134,"From other Worlds: Short stories by various authors, edited by August Derleth (Four Square Books. no. 1107) [Paperback] Derleth, August",1964,???
30671314351,"Atlantis: The Antediluvian World [Hardcover] Donnelly, Ignatius (ed. Egerton Sykes)",1960,???
30671474755,Away From The Here And Now Stories In Pseudo-Science,,???
30671489659,Bulfinch's Mythology: The Age of Fable / The Legends of Charlemagne / The Age of Chivalry (Laurel Classic),1967,???
30671498185,Bulfinch's Mythology: The Age of Fable / The Legends of Charlemagne / The Age of Chivalry (Laurel Classic),1967,???
30671498696,The Kebra Nagast-The Queen of Sheba Her Only Son Menyelek,,???
30671518373,Bulfinch's Mythology: The Age of Fable,,???
30671520483,Persuasion (Bantam Classics),,???
30671528871,"Magazine of Horror: The Bizarre Frightening Gruesome (Volume 3, Number 2, Winter 1966 1967, Whole No. 14)",,???
30671530710,"The House on the Borderland (Essential Gothic, SF & Dark Fantasy)",,???
30671534590,The Hound of the Baskervilles (Book and DVD),,???
30678972330,Enchantress of Venus: An Eric John Stark Adventure,,???
30678994579,The Mercurian: Three Tales of Eric John Stark,,???
30679065572,Changeling,,???
30679102454,"The Return of the King (The Lord of the Rings, Part 3)",,???
30679109109,Emma (Barnes & Noble Classics),,???
30679110615,"Acts of light, Emily Dickinson: Poems",,???
30679121269,Black Coffee: A Hercule Poirot Novel (Hercule Poirot Mysteries),,???
30679121974,Emma (Barnes & Noble Classics),,???
30679123520,Laughter and Chills: Seven Great Stories (Townsend Library Edition),,???
30679123901,The Chronicles of Amber Volume 11,,???
30679249211,Beyond The Gate Of Dream,1969,???
30679520052,Father Marquette and the Great Rivers (Vision Book),,???
30682176053,Egyptian Ideas of the Afterlife,,???
30683695026,"Osiris and the Egyptian Resurrection, Vol. 1",,???
30683702793,Mind Wizards of Callisto,1975,???
30683706939,Red Moon and Black Mountain,1971,???
30684134724,"Osiris and the Egyptian Resurrection, Vol. 1",,???
30684154935,"Osiris and the Egyptian Resurrection, Vol. 1",,???
30684169649,"Osiris and the Egyptian Resurrection, Vol. 1",,???
30684481086,"Osiris and the Egyptian Resurrection, Vol. 1",,???
30684726678,Six Great Sherlock Holmes Stories,,???
30684734139,"Osiris and the Egyptian Resurrection, Vol. 1",,???
30684747183,Ghost and Horror Stories of Ambrose Bierce,,???
30685033181,In the Midst of Life: Tales of Soldiers and Civilians,1978,???
30685044905,A Christmas Carol: Dicken's Classic Tale Retold for Young Children,,???
30685244095,Egyptian Magic,,???
30685334841,"Atlantis, The Antediluvian World - Large Print Edition",,???
30685358770,Bulfinchs Mythology: Stories of Gods and Heroes (Word Cloud Classics),,???
30685407896,When the Green Star Calls,1973,???
30685433786,A Christmas Carol (The Kennett Library),,???
30685445134,le miroir se brisa,,???
30685536025,Bulfinch's Mythology: The Age of Fable / The Legends of Charlemagne / The Age of Chivalry (Laurel Classic),1967,???
30685561094,Aishah: The Beloved of Mohammed,,???
30685589956,Sense and Sensibility (Wordsworth Classics),,???
30685685251,Pride and Prejudice,,???
30685686258,inZone Books: Mysteries of Sherlock Holmes (Reader's Workshop),,???
30686145593,"Tarzan Triumphant (Ballantine 21909, #15)",1974,???
30686145687,Jungle Tales of Tarzan #6,1972,???
30686145728,"Tarzan, Lord of the Jungle (Tarzan, #11)",1972,???
30686147481,Tarzan the Invincible,1974,???
30686147550,"The Beasts of Tarzan #3 (Tarzan, Volume 3)",1973,???
30686147551,Tarzan's Quest,1974,???
30686148460,Tarzan And the Jewels of Opar (Tarzan #5),1972,???
30686148461,Son of Tarzan,1972,???
30686148505,"Tarzan And The Leopard Men (Ballantine 21912, #18)",1974,???
30686148506,Tarzan The Terrible #8,1972,???
30686151408,Tarzan and the Forbidden City,1974,???
30686151549,Tarzan the Untamed,1972,???
30686152404,Tarzan at the Earth's Core,1974,???
30686152413,Tarzan and the Madman,1974,???
30686153919,Tarzan and the Lost Empire,1972,???
30686154991,"Tarzan and the Ant Men, No.10",1972,???
30686227122,Self-Reliance and Other Essays (Dover Thrift Editions),,???
30686227547,Self-Reliance and Other Essays (Dover Thrift Editions),,???
30686232758,Self-Reliance and Other Essays (Dover Thrift Editions),,???
30686233860,Persuasion (Bantam Classics),,???
30686234096,"Sherlock Holmes: The Complete Novels and Stories, Vol. 1",,???
30686241918,Bowhunting Equipment & Skills: Learn From the Experts at Bowhunter Magazine (The Complete Hunter),,???
30686355495,The Hound of the Baskervilles (Dover Thrift Editions),,???
30686432690,Worlds of Tomorrow,1958,???
30686485432,Egyptian Magic,,???
30686546984,Saint Ignatius and the Company of Jesus (Vision Books),,???
30686597944,Bulfinch's Mythology: The Age of Chivalry and the Legends of Charlemagne,1962,???
30686655750,The Key To Theosophy,,???
30686800845,Magazine of Horror # 11 November 1965 (Nov.),1965,???
30686801335,Pride and Prejudice (Collins Classics),,???
30686853429,Egyptian Magic,1971,???
30686881413,Truth Quest: Inductive Student Bible,,???
30686904095,"Conan the Swordsman (The Authorized New Adventures of Robert E. Howard's Conan, Book 1)",1978,???
30686911364,The Sign of Four: A Sherlock Holmes Mystery,,???
30686912432,The Moving Finger (Miss Marple Mysteries),,???
30686912643,"Ambrose Bierce's Write It Right: The Celebrated Cynic's Language Peeves Deciphered, Appraised, and Annotated for 21st-Century Readers",,???
30686914541,Star Wars The Empire Strikes Back The Marvel Comics Version,,???
30687014348,"THE BOOK OF THE DEAD The Hieroglyphic Transcript of the Papyrus of ANI, the Translation Into English and an Introduction",1970,???
30687368607,Emma (Collins Classics),,???
30687472085,Sky Pirates of Callisto,1975,???
30687490095,An August Derleth Reader,,???
30687507942,The Return of Tarzan (Tarzan #2),1972,???
30687537405,Bolts of Melody : New Poems of Emily Dickinson,,???
30687553204,The Adventures of Sherlock Holmes,,???
30687562914,The Essential Dickinson,,???
30687572705,New lands,,???
30687626585,Flashing Swords! No. 5: Demons and Daggers,,???
30687640451,Flashing Swords! No. 5: Demons and Daggers,,???
30687664093,"Three Times Infinity: Original Gold Medal Collection of Novelettes: Lorelei of the Red Mist (Ray Bradbury & Leigh Brackett), The Golden Helix (Theodore Sturgeon) & Destination Moon (Robert Heinlein)",,???
30687704182,The Devil's Dictionary,,???
30687750406,Complete Short Stories Volume 2,,???
