"Book_ID","Title","Release_Date","Location"
22505124663,Black Legion of Callisto,1972,???
22505125174,The Evil That Men Do / The Purloined Planet,1969,???
22505125304,The Evil That Men Do / The Purloined Planet,1969,???
22505126438,The Ginger Star,1976,???
22505126581,Under the Green Star,1972,???
22505126872,Race To The Stars,1958,???
22505276004,Future Tense,1968,???
22505276083,Collision Course / The Nemesis from Terra,1961,???
22506238385,The Memoirs of Solar Pons - The Adventures of Solar Pons #3. ( Third of the Solar Pons Series),1975,???
22506238387,The Reminiscences of Solar Pons - The Adventures of Solar Pons #5. ( Fifth of the Solar Pons Series),1975,???
22506238390,TOWER OF ZANID (Airmont Book # SF2 );.,1963,???
22507721140,Wisconsin Country: A Sac Prairie Journal,1965,???
22513525406,"Bulfinch's Mythology, The Age of Fable with a Foreword by Robert Graves",1968,???
22513526694,The Age Of Fable Or Beauties Of Mythology,1898,???
22513526707,The Age of Fable or Beauties of Mythology,1935,???
22513611367,"Tutankhamen Amenism, Atenism and Egyptian Monotheism with Hieroglyphic Texts of Hymns to Amen and Aten",1979,???
22513613126,Atlantis: The Antediluvian World,1949,???
22513613662,"The Book of the Dead: The Papyrus of Ani In the British Museum. The Egyptian Text with Interlinear Transliteration and Translation, A Running Translation, Introduction, etc.",,???
22513613958,Concord Rebel: A Life of Henry David Thoreau,1962,???
22513631094,"Tutankhamen: Amenism, Atenism, and Egyptian Monotheism",1979,???
22513634548,The Age of Fable or Beauties of Mythology,1935,???
22513635665,"The Outer Reaches, favorite science-fiction tales chosen by their authors",1951,???
22513637553,Atlantis The Antediluvian World,,???
22513644941,Egyptian Language; Easy Lessons in Egyptian Hieroglyphics with Sign List,1971,???
22513649275,Shot in the Dark,1950,???
22513649552,Countryman's Journal,1963,???
22513656251,"The Age of Fable, or Beauties of Mythology",1898,???
22513662223,"Atlantis, The Antediluvian World",1949,???
22513672719,Atlantis: The Antediluvian World,1975,???
22513679909,The Age of Fable or the Beauties of Mythology,1942,???
22513683675,The Book of Skaith: The Adventures of Eric John Stark (includes) The Ginger Star & The Hounds of Skaith & The Reavers of Skaith,1976,???
22513684981,The Age of Fable or The Beauties of Mythology,1942,???
22513697980,The Trojan War: With Introductory Notes On The Grecian Divinities Adapted From The Age Of Fable,1957,???
22513714468,Great Science Fiction Stories: Number 3,1966,???
22515005234,Selections from Prattle,1936,???
22516028825,GINGER STAR,1974,???
22516081076,The Dark Man And Others - 15 Journeys Into The Weird And The Fantastic,1963,???
22516081077,The Dark Man And Others - 15 Journeys Into The Weird And The Fantastic,1963,???
22516081078,The Dark Man And Others - 15 Journeys Into The Weird And The Fantastic,1963,???
22516131876,The vampyre: a tale,,???
22516153994,Disney's Tarzan,,???
22516161984,Emma (Signet Classics),,???
22516190284,Sense and Sensibility (Oxford World's Classics),,???
22516724558,The Classic Treasury of Bulfinch's Mythology,,???
22516724725,A Christmas Carol (Puffin Classics),,???
22516815362,THE CHARWOMAN'S SHADOW. (Ballantine Adult Fantasy),1973,???
22517239430,La Geste de Kadji,1976,???
22519645494,Sense and Sensibility (Enriched Classics),,???
22519779601,Bolts of Melody: new poems of Emily Dickinson,1945,???
22520277504,LE MONDE DE SATAN - COLLECTION PRESENCE DU FUTUR.,1970,???
22520434784,"ALFRED HITCHCOCK Mystery Magazine: October, Oct. 1962",1962,???
22520444881,ELEPHANTS CAN REMEMBER,1973,???
22520787981,Beachheads in Space,1952,???
22520788031,Village Daybook: A Sac Prairie Journal,1947,???
22520788137,Beachheads in Space,1952,???
22520788139,Other Side of the Moon,1949,???
22521759448,"Scandinavia, Ancient and Modern; Being a History of Denmark, Sweden and Norway: Comprehending a Description of These Countries; An Account of the Mythology, Government, Laws, Manners, and Institutions of Early Inhabitants (.), vol. I, second edition",1838,???
22522031318,"101 Great American Poems (Dover Thrift Editions)",,???
22522374020,Concord Rebel A Life of Thoreau,1962,???
22522472140,Egyptian Ideas of the Afterlife (Paperback),,???
22522700240,FANTASTIC UNIVERSE JULY 1957,1957,???
22522700517,AUTHOR AND JOURNALIST FEBRUARY 1955,1955,???
22522700518,AUTHOR AND JOURNALIST JUNE 1959,1959,???
22523931843,LES HOMMES STELLAIRES - COLLECTION LE MASQUE SCIENCE FICTION N°8.,1974,???
22524110709,"SCIENCE FICTION CLASSICS: No. 1, 1967",1967,???
22524127455,The Shuttered Room and Other Tales of Horror,1974,???
22524127457,H.P. LOVECRAFT AND OTHERS - Tales Of The Cthulhu Mythos Volume 1. - The Call of Cthulhu; The Return of the Sorcerer; Ubbo Sathla; The Black Stone; The Hounds of Tindalos; The Space Eaters; The Dweller in Darkness; Beyond the Threshold; The Salem Horror;,1975,???
22525246814,Emma (Penguin Classics),1966,???
22526701840,The Hounds of Skaith (Paperback),,???
22531235089,"The Gods of the Egyptians, Volume 2 (Paperback or Softback)",1969,???
22531817755,Le peuple du talisman,1977,???
22531841496,Jandar of Callisto,1972,???
22531841498,Black Legion of Callisto,1972,???
22531841499,Time War,1974,???
22531841501,When the Green Star Calls,1973,???
22531841502,Under the Green Star,1972,???
22531841505,Flame of Iridar and Peril of the Starmen,1967,???
22531841506,Quest of Kadji,1972,???
22531841507,Lost World of Time,1969,???
22532035809,Startling Stories 1954 Vol. 31 # 3 Spring: The Houses of Iszm / Runaway / Peeping Tom / Little Enos / Stop-Over / The Sound of Willow Pipes,,???
22532690115,An Occurrence at Owl Creek Bridge,,???
22532747822,"THE AGE OF FABLE, Bulfinch's Mythology",1881,???
22533195948,Selected Poems and Letters of Emily Dickinson,,???
22533323906,The Monk And The Hangman's Daughter ( The Travellers' Library 34 ),1927,???
22533413916,Det Sovjetiske Samfund - En Beskrivelse Af Sovjetunionens Okonomiske Og Sociale Udvikling,1963,???
22535119701,The Book Of Skaith hc Leigh Brackett Book Club Ed; 1976 1st Ed,1976,???
22535152806,Emily Dickinson Songs: Out of the Morning,1958,???
22535154883,Un Pelerin d'Angkor,,???
22536083174,Organ building and design;,1969,???
22536451488,"And You, Thoreau!",1944,???
22538662085,THE AGE OF FABLE OR STORIES OF GODS AND HEROES. Introductory Essay By Dudley Fitts. Illustrated by Joe Mugnaini.,1958,???
22538807727,"The Gods of the Egyptians, Volume 2",1969,???
22539793875,Rejse i Italien. Med danske forfattere i Mellemitalien.,,???
22539793878,Rejse i Italien. Med danske forfattere over Alperne til Firenze.,,???
22539795352,Myths of Greece and Rome,,???
22540083916,Tarzan at the Earth's Core,1974,???
22540084126,"The Best of Planet Stories, No. 1: Strange Adventures on Other Worlds",1974,???
22540084392,The Best of Leigh Brackett (A Del Rey Book),1977,???
22540594567,Ultimate world,1975,???
22540656773,The Coming of the Terrans,1976,???
22540656781,Conan (Conan #1),1967,???
22540662528,Thongor Against the Gods,1979,???
22540672906,"Thongor and the Wizard of Lemuria (Thongor, Book 1)",1969,???
22540679446,Renegade of Callisto (Jandar #8),1978,???
22543220215,"THE LIFE AND DIARY OF LIEUT. COL. J. BLACKADER, of the Cameronian Regiment, and Deputy Governor of Stirling Castle; Who Served with Distinguished Honour in the Wars under King William and the Duke of Marlborough, and Afterwards in the Rebellion of 1715 ",1824,???
22543314164,The Monk and the Hangman's Daughter and Other Stories. . (Avon # 628).,1955,???
22543314165,The Monk and the Hangman's Daughter and Other Stories. . (Avon # 628).,1955,???
22544960744,Monk and the Hangman's Daughter,1967,???
22550918654,"Osiris and the Egyptian Resurrection, Vol. 1 (Paperback)",,???
22552642457,FLASHING SWORDS 4: BARBARIANS AND BLACK MAGICIANS,1977,???
22552654860,Renegade of Callisto (Volume 8 in the Saga of Jandar of Callisto),1978,???
22555058233,"THRILLING WONDER Stories: April, Apr. 1949",1949,???
22555717558,"Wilbur, The Trusting Whippoorwill",1959,???
22555766146,The Shield of the Valiant,1945,???
22556392789,The Hounds of Skaith,1974,???
22556554080,Bulfinch's Mythology (Paperback),,???
22556837476,HORROR HUNTERS (ANTHOLOGY OF 8 STORIES),1971,???
22557661397,"The World's Best Fifty Short Novels, Vol. 1",1929,???
22558108961,"Collected Poems Of Emily Dickinson[Hardcover,1986]",,???
22558294406,"Adventure of Sherlock Holmes, the",1975,???
22558506214,Wolverine Snikt! #1,,???
22559207355,When the green star calls. Illus. by Luis Dominguez.,1973,???
22559207371,As the Green Star Rises,1975,???
22559208144,"Golden cities, far",1970,???
22559208204,Dwellers in the mirage,1962,???
22559208238,The Ginger Star,1979,???
22559624404,"Bulfinch's Mythology: The Age of Fable, The Legends of Charlemagne, The Age of Chivalry (Laurel Classic)",1959,???
22560630213,The Golden Bottle: Or the Story of Ephraim Benezet of Kansas (Classic Reprint),1968,???
22561590994,Adventures of Solar Pons,1976,???
22568350908,Thongor of Lemuria,1966,???
22571528217,"Great Expectations (Rinehart Editions, 20)",,???
22571731549,The Monk and the Hangman's Daughter,1967,???
22571859911,Famous Science Fiction Volume 1 Number 1,,???
22572016690,"13 West Street (The Tiger Among Us)",1962,???
22572119338,Studies in Occultism,1973,???
22572746414,THE AGE OF FABLE,1966,???
22572751187,THRILLING WONDER STORIES FEBRUARY 1950,1950,???
22572947775,Quick Check Food Facts,,???
22572980762,Portals of Tomorrow.,1954,???
22574272512,The Years's Best Fantasy : 2,1976,???
22574614745,"FANTASTIC Stories: October, Oct. 1969",1969,???
22575586411,GREAT SHORT NOVELS OF ADULT FANTASY - VOLUME I (Book One),1972,???
22575683919,"13 West Street (Corgi Books. no. SC1184.)",1962,???
22575766169,TIME WAR. - FRANK FRAZETTA Cover.,1974,???
22575766170,TIME WAR. - FRANK FRAZETTA Cover.,1974,???
22578928888,The Trail of Cthulhu,1976,???
22579404968,KING KULL ( Lancer Book # 73-650; Fantasy-Adventures Mightiest Hero.],1967,???
22581585718,A Wisconsin Harvest,1966,???
22581661142,"FANTASTIC Stories: October, Oct. 1975",1975,???
22581901828,Sense and Sensibility (Dover Thrift Editions),,???
22582318092,"Selected English Short Stories, XIX & XX Centuries (Second Series series): The Oxford World's Classics, CCXXVIII (228); Sailor Uncle, Maypole of Merry Mount, Purloined Letter, Cask of Amontillado, The Holly Tree, etc.",1940,???
22582520928,Fear No Evil (The Tiger Among Us) SC902,1960,???
22582931736,Emily Dickinson (PHOENIX HARDBACK POETRY),,???
22583024559,Complete poems of Emily Dickinson,1960,???
22583034287,The Only Place We Live,1976,???
22583936579,More Little Monsters: A Manor Science Fiction Great (inc.Doll That Does Everything; Friends?; Twilight Play; Shadowy Third; Transfer; Rosy Future Roderick; Brenda; Mr George; Little Witch Elm Street; Little Jimmy; Tooth Fairy; Robbie David & Dahl ),1973,???
22583979507,Kinesiske religioner og livsformer.,,???
22585125638,From Other Worlds,1964,???
22585196763,CONAN THE SWORDSMAN,1978,???
22585982483,"The Wind Leans West. First Edition, Dust Jacket. New York, 1969",1969,???
22585982484,"Collected Poems. First Edition, Dust Jacket. New York, 1967",1967,???
22585982485,"Portals of Tomorrow. The Best Science Fiction and Other Fantasy. First Edition, Dust Jacket. Derleth, Bradbury, Clarke. New York, 1954",1954,???
22585982487,"Beachheads in Space. Ed. By Derleth. No Place, 1952",1952,???
22585982488,"Return to Walden West. First Edition, Dust Jacket. Illustrated. New York, 1970",1970,???
22585982489,"A House Avoce Cuzco. First Edition, Dust Jacket. New York, 1969",1969,???
22586126293,Atlantis: The Antediluvian World: A Modern Revised Edition,1949,???
22586126486,The Shadow In The Glass,1963,???
22586134139,"The Age Of Chivalry; Or Legends Of King Arthur, 'King Arthur And His Knights', 'The Mabinogeon', 'The Crusades', 'Robin Hood', Etc.,",1884,???
22586406070,"LA DOCTRINA SECRETA. SINTESIS DE LA CIENCIA, LA RELIGION Y LA FILOSOFIA. Volumen IV: El Simbolismo Arcaico de las Religiones del Mundo y de la Ciencia.",1978,???
22589345816,Walden West,1961,???
22589351116,The Collected Writings of Ambrose Bierce,1968,???
22589529202,"Worlds of If Science Fiction, Vol.15 No.3, March 1965",1965,???
22589996211,Oliver Twist,,???
22592672501,"Time to Come. Science Fiction of Tomorrow. Philip K. Dick, Asimov, Clarke. New York, 1954",1954,???
22592682564,Ignatius Donnelly: The Portrait of a Politician (with account of his work on Atl,1962,???
22592723854,BEACHHEADS IN SPACE,1957,???
22593275020,LA ESPADA DE RHIANNON,1977,???
22594336606,Skagen i fortid og nutid. Tegninger af Alex Secher.,,???
22594340305,Tolkien: A Look Behind The Lord of the Rings,,???
22595820443,David Copperfield (Authoritative Modern Abridgment),,???
22596007898,BARBARIANS AND BLACK MAGICIANS: FLASHING SWORDS! #4 by LIN CARTER (EDITOR),,???
22596070641,The Devil's Dictionary,1975,???
22596630447,The History Of The Blessed Virgin Mary And The History Of The Likeness Of Christ Which The Jews Of Tiberias Made To Mock At. The Syriac Texts,,???
22597898993,"Isaac Asimov's Science Fiction Magazine, Vol. 3, No. 4 (April, 1979)",,???
22598050828,Bulfinch's Mythology: The Age of Fable (Courage Classics) (v. 1),,???
22599865793,"1948 Thrilling Wonder Stories Pulp Magazine: Ray Bradbury - John D. MacDonald - Leigh Brackett - The Moon That Vanished - Yesterday's Door - The Cosmic Jackpot - Science Fiction",1948,???
22599912075,Bulfinch's Mythology,1969,???
22599942596,Wisconsin Country: A Sac Prairie Journal,1965,???
22600955699,Forest Orphans,1964,???
22600987149,Murder Made in Moscow: Complete Short Novel in *TheSaint Mystery Library* #5,,???
22605110741,The Shadow in the Glass,1963,???
22605163923,"FANTASTIC Stories: February, Feb. 1973 ('The Fallible Fiend')",1973,???
22605512164,I'm Nobody! Who Are You?,,???
22606365090,The Wizard of Zao,,???
22606628808,PORTALS OF TOMORROW: The Altruists; The Hypnoglyph; Testament of Andros; Gratitude Gruaranteed; Rustle of Wings; The Other Tiger; Civilized; Stickeney and the Critic; The Word; Hermit on Bikini; Jezebel; D. Pl from Tomorrow; Potential; Eye for Iniquity ,1954,???
22607281731,Studies in Occultism,1973,???
22607355154,Tarzan Triumphant (Tarzan Series #15),1975,???
22608041528,Jungle Tales of Tarzan (Tarzan #6),1976,???
22608632971,ERBania #19 (April 1966),1966,???
22608632972,"Amra Vol. 2, #43 (March 1967)",1967,???
22608632987,The Magazine of Horror #7 (Jan. 1965),1965,???
22608632990,The Magazine of Horror #14 (Winter 1967),1967,???
22608633001,"Amra Vol. 2, #45 (Dec. 1967)",1967,???
22608633408,"Planet Stories Vol. 5, No. 9 (Nov. 1952)",1952,???
22608633414,"Planet Stories Vol. 1, No. 7 (Summer 1941)",1941,???
22608666448,Return to Walden West,1970,???
22608766822,New Poetry Out of Wisconsin,1969,???
22609490519,Selected Poems Of Emily Dickinson,1948,???
22609855716,A Boy's Way,1947,???
22609855717,It's a Boy's World,1948,???
22609904651,Return to Walden West,1970,???
22610147009,Boris Karloff's Favorite Horror Stories : The Thirteenth Floor; Child of the Winds; The Opener of the Crypt; The Thing That Walked on the Wind; The Scarlet King; The Graveyard Reader; The Mindworm; Back from the Grave (Avon Books #G126),1965,???
22613158912,Age Of Chivalry Legends Of Charlemagne,1962,???
22614501349,Organ Building and Design,1969,???
22615210486,The Sword of Rhiannon,1979,???
22616280121,"1949 Thrilling Wonder Stories Pulp Magazine: Ray Bradbury - L. Ron Hubbard - Leigh Brackett - Henry Kuttner - L. Sprague de Camp",1949,???
22617901667,Gulliver's Travels (The Great Writers Library),,???
22617918182,Personal Memoirs of H. P. Blavatsky,1967,???
22618049166,The Quest of Kadji,1971,???
22618049226,Ultimate World,1975,???
22618049877,The Big Jump,1967,???
22618053029,Three Times Infinity,1958,???
22618054214,The Star Magicians/The Off-Worlders,1966,???
22618075376,Atlantis: The Antediluvian World,1882,???
22618341034,The Milwaukee Road: Its First Hundred Years,1969,???
22618645416,Alpha ou la mort - Le recommencement,1976,???
22619067596,The Only Place We Live,1976,???
22619234837,Survivor and Others,1971,???
22619507708,"The Pursuit of Liberty, Vol. 1",,???
22619683436,Mythology of Greece and Rome,1962,???
22620324926,"Hounds Of Skaith, The: Vol 2, Book Of Skaith",1974,???
22620324936,"Ginger Star, The",1979,???
22620328193,"Hounds of Skaith, The: Vol 2, Book of Skaith",1979,???
22620328357,Alpha Centauri or Die!,1963,???
22620328363,"Coming of the Terrans, The",1967,???
22620328368,"Nemesis from Terra, The",1961,???
22620328373,"Ginger Star, The",1979,???
22621483628,"And You, Thoreau!",1944,???
22622882405,Concord Rebel: A Life of Henry David Thoreau,1971,???
22626192841,"Scandinavia: Ancient and Modern, being a history of Denmark, Sweden and Norway in 2 volumes, complete. Harper's Family Library 156 and 157.",1843,???
22629698800,Sense and Sensibility,,???
22629703149,Savage Tales #1 (1),,???
22629703150,Savage Tales #1 (1),,???
22630855878,"The Age of Fable, or The Beauties of Mythology",1942,???
22630856527,Emily Dickinson,1967,???
22633590413,Famous Ghost Stories (Watermill Classics),,???
22639743684,La Huella De Cthulhu,1977,???
22639829216,Mr. Fairlie's Final Journey (Solar Pons No. 7),1976,???
22639983322,The chronicles of Solar Pons (Solar Pons series),1974,???
22639987319,Egyptian Religion,1979,???
22639995644,The Gods of the Egyptians or Studies in egyptian mythology - Volume 1,1969,???
22639995645,The Egyptian book of the dead The Papyrus of Ani) Egyptian text transliteration and translation,1967,???
22640008014,The Devil's Dictionary,1958,???
22641192050,Someone in the Dark,1978,???
22642453987,"FAMOUS FANTASTIC MYSTERIES: February, Feb. 1948",1948,???
22642971699,"The Casebook of Solar Pons (Solar Pons, No 4)",1975,???
22643675978,The Devils Dictionary,1979,???
22643917516,"From other Worlds: Short stories by various authors, edited by August Derleth (Four Square Books. no. 1107)",1964,???
22644693504,THE HOUSE ON THE BORDERLAND by WILLIAM HOPE HODGSON,,???
22646391898,Regarding Sherlock Holmes : #1/The Adventures of Solar Pons,1974,???
22647999288,Beyond The Gates Of Dream,1969,???
22648683565,"The Casebook of Solar Pons (Solar Pons, No 4)",1975,???
22649162019,Fungi from Yuggoth and Other Poems,1971,???
22649198727,Write It Right: A Little Blacklist of Literary Faults (Paperback),,???
22649310392,The Stuff of Dreams: The Weird Stories of Edward Lucas White (Paperback),,???
22649811785,The Bricks and Anchors: A Brief History and Practical Advice for the Politically Disenchanted (Paperback),,???
22650687536,The Devil's Dictionary,,???
22655464749,The Reavers of Skaith (#3 Further Adventures of John Stark),1976,???
22655601112,Pride and Prejudice (Barnes & Noble Classics Series) (B&N Classics),,???
22655928280,"The Secret of Sinharat, People of the Talisman",1964,???
22656981351,"Scandinavia, ancient and modern being a history of Denmark, Sweden, and Norway . with illustrations of their natural history Volume 1st ( 1841)[HARDCOVER]",,???
22659676364,"THRILLING WONDER STORIES (Pulp magazine. February,1950) 'Payment in Full' by Ray Bradbury / 'Spectator Sport' by John D. MacDonald / 'The Voice of the Lobster' by Henry Kuttner.",1950,???
22659676365,"THRILLING WONDER STORIES (Pulp magazine. February,1950) 'Payment in Full' by Ray Bradbury / 'Spectator Sport' by John D. MacDonald / 'The Voice of the Lobster' by Henry Kuttner.",1950,???
22660281485,The Warrior of World's End,1974,???
22660349164,"The Return of Solar Pons (Solar Pons, 6)",1975,???
22661134609,Outer Reaches: Favorite Science-Fiction Tales Chosen By Their Authors,1951,???
22662863331,FOUR VOLUMES: The Best of Henry Kuttner; Fredric Brown; Edmond Hamilton; Fritz Leiber (inc.proud Robot; Gnome There Was; Twonky; Geezenstacks; Star Mouse; Alien Earth; Day of Judgement; Pail of Air; Poor Superman; etc) ),1979,???
22665165891,Harrigan's File,1975,???
22665761589,Beachheads in Space (Berkley Books # G-77 );,1952,???
22665761590,THE OUTER REACHES. (Berkley Books # G-116 );,1951,???
22665761591,THE OUTER SIDE OF THE MOON. (Berkley Books # G249 );,1949,???
22665761592,WORLD OF TOMORROW. (Berkley Books # G-163 );,1958,???
22665761593,TIME TO COME. (Berkley Books # G-189 );,1958,???
22665761594,STRANGE PORTS OF CALL. - with 10 Short Stories. (Berkley Books # G-131 );,1958,???
22665761597,FAR BOUNDARIES. - with 18 Short Stories.,1967,???
22665761598,BEYOND TIME AND SPACE. With 8 short stories(Berkley Books # G-104 );,1950,???
22665761599,WORLDS OF TOMORROW - Exploring the Vast Boundaries of Space and Time with Top Science Fiction Writers. - with 10 Short Stories.,1963,???
22665761600,TIME TO COME. - with 12 Short Stories. (Pyramid Book # T-2012 );.,1969,???
22665761601,STORIES FROM SLEEP NO MORE. - with 9 Short Stories. (Bantam Book # H3425 );.,1967,???
22665761602,SOMEONE IN THE DARK. - with 19 Short Stories (Paperback edition).,1978,???
22666086585,"H. P. Blavatsky: Collected Writings, 14 (Miscellaneous)",1966,???
22666464225,As the Green Star Rises (Green Star #4),1975,???
22667217836,Egyptian Religion,,???
22667813174,The Story of Thomas E. Dewey,1944,???
22667841332,The Hounds of Skaith,1974,???
22671582460,"Dynamics of the Psychic World: Comments by H.P. Blavatsky on Magic, Mediumship, Psychism and the Powers of the Spirit (Quest Book Original)",1972,???
22671598269,A Christmas Carol,,???
22672225373,Quatre histoires de Zombi,,???
22672235791,"Thongor à la fin des temps, le cycle de Thongor / 3",,???
22675427023,Songs of Innocence and Songs of Experience (Dover Thrift Editions),,???
22675915100,Eric John Star #1: The Ginger Star,1974,???
22675915127,The Big Jump,1955,???
22675915135,The Hounds of Skaith: Adventures of Eric John Stark #2,1974,???
22675993140,The Big Jump,1955,???
22676102550,Bulfinch's Mythology,1973,???
22677682139,Two Complete Science Fiction Novells: The Thief of Toth & . And Others Shall be Born,1968,???
22677682146,When the Green Star Calls,1973,???
22678206534,CONAN THE CONQUEROR/THE SWORD OF RHIANNON,1953,???
22680042894,Sky Pirates of Callisto,1975,???
22680949616,When the Green Star Calls,1973,???
22682211802,"History of Arabia and Its People an Account of the Country and Its Inhabitants, the Life and Religion of Mohammed, the Conquest, Etc",1852,???
22683265683,The Liturgy of Funerary Offerings: The Egyptian Texts with English Translations,1972,???
22686306855,ALONE BY NIGHT - Tales of Unlimited Horror,1967,???
22688900692,Bulfinch's Mythology: The Age of Fable Vol 1,1962,???
22689747533,I'm Nobody! Who Are You? (Scholastic Classics),,???
22696512710,A Christmas Carol,,???
22698780906,Emma,,???
22698836495,The Night Before Christmas,,???
22699539308,The Ginger Star (Planet Skaith adventures),,???
22700559616,THE MOON MEN,1969,???
22701861458,ALPHA OU LA MORT- LE RECOMMENCEMENT,1976,???
22701875168,Wind in the Elms. Poems,1941,???
22701889737,The Galactic Breed / Conquest of the Space Sea (Classic Ace Double D-99),1955,???
22701889744,"People of the Talisman / The Secret of Sinharat (Ace Double, No. 75781)",1964,???
22702647721,The Reminiscences of Solar Pons,1975,???
22702647722,The Casebook of Solar Pons,1975,???
22702895991,The Time Of Infinity,1963,???
22703266203,My Life Had Stood a Loaded Gun (Penguin Little Black Classics),,???
22706507231,Thongor of Lemuria,1966,???
22707166985,The Evil That Men Do / The Purloined Planet,1969,???
22719066369,Titans Tochter,1975,???
22723629553,L'épée de rhiannon,,???
22727220399,Emily Dickinson (Poetry for Young People S.),,???
22728922374,In The Midst Of Life & Other Stories ( Tales of Soldiers and Civilians ),1961,???
22731583075,FANTASTIC Stories: July 1973,1973,???
22732607947,West of Morning,1960,???
22734094801,Tarzan And The Golden Lion,,???
22734095018,Trips in Time: Nine Stories of Science Fiction,,???
22734127070,From Other Worlds,1964,???
22737143628,The Coming of the Terrans,1976,???
22737562154,The Hounds of Skaith . Stark # 2,1974,???
22742908918,The Coming of the Terrans,1967,???
22743012772,Age Of Fable,1966,???
22743012987,Bulfinch's Mythology,1967,???
22745454557,Bulfinch's Mythology,,???
22745556161,THE MOON MEN,1968,???
22745556192,"THRILLING WONDER Stories: December, Dec. 1950",1950,???
22747517530,"Tutankhamen: Amenism, Atenism and Egyptian Monotheism",,???
22747896299,The Nemesis from Alpha,,???
22750996687,The Unpardonable Sin,1918,???
22751211936,Swords of Mars (The Martian Tales of Edgar Rice Burroughs #8),1979,???
22751211940,The Warlord of Mars (The Martian Tales of Edgar Rice Burroughs #3),1979,???
22753799362,The Best of Leigh Brackett,1977,???
22753982091,"The Mummy: The Secrets of Ancient Egypt's Funereal Amulets and Scarabs, Idols and Mummy-making, and How to Read Heiroglyphics",1972,???
22754527390,"The Illustrated Natural History | Three Volumes. Volume 1: Mammalia; Volume 2: Birds; Volume 3: Reptiles, Fishes, Molluscs Etc. [3 / III Volumes]",1859,???
22754651656,"Bulfinch's Mythology: The Age of Fable, or Beauties of Mythology - Revised By Rev. E. E. Hale",1881,???
22754727956,SATURN: May 1957,1957,???
22757110072,CÆSAR'S COLUMN A Story of the Future.,1906,???
22759302953,The Mill Creek Irregulars: Special Detectives,1959,???
22760802103,Favorite Poems Of Emily Dickinson,,???
22761804950,I'm Nobody! Who Are You?: Poems of Emily Dickinson for Children (Poetry for Young People Series),,???
22762519164,Hallowe'En Party: a Hercule Poirot Murder Mystery,,???
22763476504,Conan the Conqueror / The Sword of Rhiannon (Two Complete Novels),1953,???
22765000892,Pride and Prejudice and Zombies,,???
22765057347,Pride and Prejudice and Zombies,,???
22765278864,Lost On Venus,,???
22765297048,The Gods of Mars & The Warlord of Mars (Barsoom Series),,???
22766035764,Six Great Sherlock Holmes Stories,,???
22766098837,The Evil That Men Do / The Purloined Planet,1969,???
22769487156,Fantastic Adventures - July 1948 - Volume 10 Number 7,,???
22769487166,"Other Worlds Science Stories, August 1952",,???
