"Book_ID","Title","Release_Date","Location"
30310723028,"The Moon Men ( Moon Trilogy, Book 2 )(Ace Books #G-748)",1925,???
30310723061,Tarzan and the City of Gold (Tarzan #16)( Ballantine Books U2016 ),1964,???
30310723081,Tarzan and the Jewels of Opar (Tarzan #5)(Ballantine Books U2005),1963,???
30310726915,Tarzan the Invincible (Tarzan #14) (Ballantine Books #U2014),1964,???
30310726918,Jungle Tales of Tarzan (Tarzan #6)(Ballantine Books F750),1963,???
30310726934,The Son of Tarzan (Tarzan #4),1977,???
30311010244,On Heroes and Hero-Worship; Representative Men,,???
30311135997,Solar Lottery & the Big Jump ( Ace Double ),1955,???
30312795298,Trumps of Doom,,???
30312800047,Pride and Prejudice (Enriched Classics),,???
30312809605,THE AGE OF FABLE,1942,???
30313008476,Bulfinch's Mythology,1963,???
30313195870,Ambrose Bierce's Civil War,,???
30313257599,The Chronicles of Solar Pons (Solar Pons series),1974,???
30313259468,"The Memoirs of Solar Pons (The Solar Pons Series, No 3)",1975,???
30313260239,"The Return of Solar Pons (Solar Pons, 6)",1975,???
30313260242,"The Casebook of Solar Pons (Solar Pons, No 4)",1975,???
30313260243,The Reminiscences of Solar Pons (#5),1975,???
30313353765,Moll Flanders,,???
30313476936,The Monk and the Hangman's Daughter. Trans. by Gustav Adolf Danziger. Adapted by Ambrose Bierce. Introd. by Maurice Valency.,1967,???
30313635409,Passenger to Frankfurt,,???
30313716940,The Sorcerer's Ship Ballantine Unicorn Fantasy,,???
30313868170,"Lars Bo. Tekster af Robert Giraud, Flemming Madsen og Poul Carit Andersen.",,???
30313894558,Dragonrouge,,???
30313976628,IF Worlds of Science Fiction: July 1967 ('Spaceman'),1967,???
30313999286,CONAN THE WANDERER. [ with Black Tears / Shadows in Zamboula/ The Devil in Iron/ The Flame Knife. . Book #4 Volume FOURTH of the Saga of Fantasy-Adventures Mightiest Hero.],1973,???
30314001950,At The Mountains of Madness and Other Tales of Terror - H P Lovecraft ( the Shunned House; Dreams in the Witch House; Statement of Randolph Carter ),1974,???
30314116259,Silent Spring,,???
30314205304,They took their stand;: The founders of the Confederacy,,???
30314258310,A Treasury of Sherlock Holmes,1955,???
30314274482,"The Arkham Collector Number Eight: Winter, 1971",1971,???
30315096965,"Tolkien: A Look Behind The Lord Of the Rings, A Joyous Exploration of Tolkien's Classic Trilogy and of the Glorious Tradition From Which it Grew",1972,???
30315127466,Tales from Beyond the Grave,,???
30315250756,"Back to the Stone Age (Pellucidar, Book 5) (Ace Books #04632)",1973,???
30315250775,The Eternal Savage (Tarzan),1914,???
30315252780,Carson of Venus (Ace Books #09202),1939,???
30315252782,"Lost on Venus ( Venus Series, Book 2 ) (Ace Books F-221)",1933,???
30315253645,"Tanar of Pellucidar ( Pellucidar, 3 ) (Ace Books #F-171)",1929,???
30315254532,"The Moon Maid (The Moon Series, Book 1 )( Ace Books # G-745 )",1923,???
30315256438,The Cave Girl (Ace Books #F-258),1963,???
30315259206,"The Moon Men ( Moon Trilogy, Book 2 )(Ace Books #53753)",1925,???
30315259207,"The People That Time Forgot (The Land That Time Forgot, Book2)",1918,???
30315259209,The Return of Tarzan (Tarzan #2)(Ballantine Books U2002),1963,???
30315259210,"Back to the Stone Age ( Pellucidar, Book 5 ) (Ace Books #F-245)",1937,???
30315609889,Bulfinch's Mythology: 2 (A Studio book),,???
30315881967,Bright Journay,1940,???
30315885052,In the Midst of Life and Other Tales,1961,???
30316232065,Journey to the Underground World,,???
30316392176,"Flashing Swords! (Flashing Swords, Volume 1)",,???
30317043455,The Tragedy of Anthony and Cleopatra (Oxford World's Classics),,???
30317299379,Rätselhafte Volksstämme. Magische und okkulte Fähigkeiten bei den Kurumbas und Todas.,,???
30317331158,Selected Writings (Enriched Classics),,???
30317835686,Tarzan And The Lost Empire,1972,???
30318024341,Mischief in the lane,1944,???
30318981216,Pirates Of Venus: F-179: Excitement In The Tarzan Tradition On The Planet Of Mystery,,???
30318986838,"STARTLING Stories: April, Apr. 1952",1952,???
30318993248,FLASHING SWORDS (5) Five: Demons and Daggers: Tower of Ice; A Thief in Korianth; Parting Gifts; A Dealing with Demons; The Dry Season,,???
30318994942,"TREASURY OF GREAT SCIENCE FICTION: Number 1, 1964",1964,???
30319781459,Three Times Infinity,,???
30319781523,Three Times Infinity,1958,???
30319994505,Reader's Digest Best Loved Books for Young Readers : Great Cases of Sherlock Holmes,,???
30320583679,Ghosts Know,,???
30320590442,On Heroes and Hero-Worship; Representative Men,,???
30320730583,Lo! More Strange Events,,???
30320977804,Bulfinch's Mythology: The Age of Fable / The Legends of Charlemagne / The Age of Chivalry (Laurel Classic) [Mass Market Paperback] Thomas Bulfinch and Edmund Fuller,1967,???
30320983832,"The Warrior of World's End Carter, Lin",1974,???
30320989634,Mr. Fairlie's Final Journey (Solar Pons No. 7) [Paperback] August Derleth,1976,???
30321388955,The Vampyre,,???
30321519029,Conan Of The Isles,1968,???
30321519030,The Big Jump,1967,???
30321521903,The Coming Of The Terrans,1967,???
30321823438,Two Queens of Baghdad. Mother and wife of Harun Al-Rashid.,1946,???
30321995028,Splendour That Was Egypt,,???
30322058048,The Devil's Dictionary,1978,???
30322074022,The Hound of the Baskervilles (Paperback Classics),,???
30322295386,The Book of the Dead,,???
30322305654,"Shadows of Carcosa : Tales of Cosmic Horror by Lovecraft, Chambers, Machen, Poe, and Other Masters of the Weird",,???
30322380092,The Pocket Emily Dickinson,,???
30322662028,Book of the Dead : The Papyrus of Ani in the British Museum,1967,???
30323050357,The God of the Witches,,???
30323616542,Isis Unveiled: Part Two Religion,,???
30323945297,Fantastic Fables,,???
30323993668,Dickinson : Poems,,???
30323999078,Bulfinch's Mythology,,???
30324002434,Tales of Soldiers and Civilians. by: Ambrose Bierce. (Original Version): Tales of Soldiers and Civilians Is a Collection of Short Stories Written by A,,???
30324125511,The Vampyre,,???
30324134990,The Vampyre,,???
30324227990,Radio Cracy & Mini Radio Craft : A Pair of Spoofy by Hugo Gernsback,,???
30324230737,No Good From A Corpse,,???
30324233101,Isis Unveiled Vol I & Ii,,???
30324271708,The Babylonian Story of the Deluge as Told by Assyrian Tablets from Nineveh,,???
30324407113,Selected Poems and Letters of Emily Dickinson,,???
30324413764,Devil's Dictionary,,???
30324554243,The Book Of The Dead (hardback),,???
30324597268,Isis Unveiled: A Master Key to the Mysteries of Ancient and Modern Science and Theology,,???
30324601302,The Babylonian Story of the Deluge as Told by Assyrian Tablets from Nineveh,,???
30324668932,"Shadows of Carcosa : Tales of Cosmic Horror by Lovecraft, Chambers, Machen, Poe, and Other Masters of the Weird",,???
30324756205,The Stanzas of Dzyan: From the Secret Doctrine,,???
30324790530,The Book Of The Dead (hardback),,???
30324807373,Book Of The Dead,,???
30324835559,The Poetry Of Emily Dickinson,,???
30324946175,The Great God Pan & Other Classic Horror Stories,,???
30325013562,The Civil War Short Stories of Ambrose Bierce REPRINT Edition,,???
30325048197,Casebook Of Carnacki The Ghost Finder NEW ED,,???
30325069136,The Babylonian Story of the Deluge as Told by Assyrian Tablets from Nineveh,,???
30325201974,Collected Poems Of Emily Dickinson,,???
30325278689,Radio Cracy & Mini Radio Craft : A Pair of Spoofy by Hugo Gernsback,,???
30325290707,Babylonian Life And History - 1891,,???
30325397508,"The Age of Fable, or Beauties of Mythology",1898,???
30325429506,The Devil's Dictionary,,???
30325601677,Babylonian Life And History - 1891,,???
30325780879,"Secrets of Egyptian Spellcasting : Amulets, Talismans, and Magickal Lifeforms",,???
30326061903,What I Saw at Shiloh : New Annotated Edition,,???
30326074483,The Devil's Dictionary: A Satirical Dictionary,,???
30326120286,The God of the Witches,,???
30326127014,Civil War Stories,,???
30326152612,Emma,,???
30326194729,Bulfinch's Mythology : All Volumes,,???
30326203994,The Book of the Dead: An Ancient Egyptian Funerary Text,,???
30326214340,Dickinson : Poems,,???
30326240665,Pride and Prejudice,,???
30326358244,The Stanzas of Dzyan: From the Secret Doctrine,,???
30326422845,Casebook Of Carnacki The Ghost Finder NEW ED,,???
30326708578,Bulfinch's Mythology,,???
30326710083,Walden West,,???
30326720014,A Traveler in Time,,???
30326852537,Book Of The Dead,,???
30326864864,The Vampyre,,???
30326968028,The Book of the Dead,,???
30326985537,Death Comes as the End,1954,???
30327006267,Isis Unveiled: A Master Key to the Mysteries of Ancient and Modern Science and Theology,,???
30327092146,The Big Jump,,???
30327159411,At the Earths Core,,???
30327172381,Collected Poems Of Emily Dickinson,,???
30327379137,Isis Unveiled Vol I & Ii,,???
30327415340,Village Daybook: A Sac Prairie Journal,1947,???
30327671115,Isis Unveiled: Part Two Religion,,???
30327696752,The Civil War Short Stories of Ambrose Bierce REPRINT Edition,,???
30327737189,People of the Talisman / The Secret of Sinharat,1964,???
30327738198,The Star Magicians / The Off-Worlders,1966,???
30327935031,"Mathematics for Elementary Teachers, Student Hints and Solutions Manual: A Contemporary Approach",,???
30328252406,John Carter: The Movie Novelization: Also includes: A Princess of Mars (John Carter of Mars),,???
30328296332,The Best of Edmond Hamilton,1977,???
30328672128,The Age of Fable or Beauties of Mythology,1962,???
30328853556,Tower of the Medusa / Kar Kaballa (Ace Double 42900),1972,???
30329063799,Classic Illustrated Sherlock Holmes: Thirty Seven Short Stories Plus a Complete Novel,,???
30329104536,Destination: Saturn / Invader On My Back,1968,???
30329763735,Measure for Measure (The New Cambridge Shakespeare),,???
30329770384,Section G: United planets (Ace science fiction),,???
30329782332,Weird Tales for November 1945,1945,???
30329782567,The Year's Best Fantasy Stories No.166,1976,???
30329786475,Weird Tales for March 1949,1949,???
30329849320,Weird Tales for November 1947,1947,???
30330052626,The Miracle of Christmas,,???
30330058014,The Curse of the Undead Classic Tales of Vampires and Their Victims,,???
30330195886,Judge Tenderly of Me: The Poems of Emily Dickinson,,???
30330352841,SIGUE EL VIENTO LIBRE,,???
30330414672,Savage Pellucidar,1973,???
30330418502,The Mucker,1974,???
30330422187,Tarzan and the Foreign Legion,1974,???
30330503977,Anthony and Cleopatra (The World's Classics),,???
30330554660,Conan the Swordsman,,???
30330559769,By the light of the Green Star,,???
30330565047,Dracula (Barnes & Noble Classics),,???
30330640069,BEYOND THE BLACK ENIGMA (Commander Craig #1),1968,???
30330798071,"Emerson, Our Contemporary",,???
30331168753,"If: Worlds of Science Fiction, January 1968 (Volume 18, Number 1, Issue 122)",1968,???
30331168755,"The Most Thrilling Science Fiction, Number 8, Spring 1968",1968,???
30331170606,The Other Side of Tomorrow,1975,???
30331173483,"The Most Thrilling Science Fiction, Number 7, Winter 1967",1967,???
30331176058,"Fantastic, August 1968 (Volume 17, Number 6)",1968,???
30331177016,"If: Worlds of Science Fiction, March 1968 (Volume 18, Number 3, Issue 124)",1968,???
30331380144,The Laurel Poetry Series: Emily Dickinson,,???
30331447564,Concord Rebel a Life of Henry D. Thoreau by August Derleth,,???
30331629979,Swordsmen in the Sky (Ace #79276),,???
30331824529,Isis sin velo: tomo I,,???
30332224873,"Reader's Digest Great Biographies, Vol. 9: Mahatma Gandhi / The Story of My Life / American Caesar: Douglas MacArthur, 1880-1964 / Walden / Madame Curie",,???
30332242505,The Book of the Damned,,???
30332992485,Le Peuple du talisman,1977,???
30333084090,Le Peuple du talisman,1977,???
30333341024,The Picture of Dorian Gray (Dover Thrift Editions),,???
30333375527,LEGENDS OF CHARLEMAGNE (EVERYMANS LIBRARY),,???
30333858914,The roar of the twenties,,???
30334124235,A Charles Dickens Christmas,,???
30334129918,King Lear (Cambridge School Shakespeare),,???
30334152781,Bulfinch's Mythology,,???
30334477657,Atlantis: The Antediluvian World,,???
30334569093,Hobbit Lord of the Rings,,???
30334573043,The War of the Worlds and the War in the Air (Wordsworth Classics),,???
30334628483,West of Morning,1960,???
30334765542,Transactions of the Blavatsky Lodge of the Theosophical Society,1946,???
30334884481,Great Expectations (Be Classics),,???
30334965305,Est-ce possible?,,???
30334987034,"Thuvia, Maid of Mars (Martian Series, No. 4)",,???
30335029127,Mind Wizards of Callisto (Dell science fiction),,???
30335076950,THE POEMS OF EMILY DICKINSON. Edited by Martha Dickinson Bianchi and Alfred Leete Hampson. Introduction by Alfred Leete Hampson.,1944,???
30335299628,Travels with Henry James,,???
30335445852,Tower At The Edge Of Time,1972,???
30335446899,The Man Who Loves Mars,1973,???
30335450368,"The Hounds of Skaith, Stark # 2.",1974,???
30335450369,The City Outside The World,1977,???
30335451279,"The Ginger Star, Stark # 1",1974,???
30335453204,Mind Wizards of Callisto,1975,???
30335454061,Jander of Callisto,1972,???
30335454062,The Warrior Of World's End: The First Book of the Gondwane Epic,1974,???
30335456011,"The Ginger Star, Stark # 1",1974,???
30335456014,Lankar of Callisto,1975,???
30335456922,Sky Pirates of Callisto,1973,???
30335880043,A Tale of Two Cities (Amsco Literature Program),,???
30335899039,As the Green Star Rises (Green Star #4),1975,???
30335972868,"FANTASTIC Science Fiction & Fantasy Stories: September, Sept. 1974 ('Will-o-the-Wisp')",1974,???
30336147779,PORTALS OF TOMORROW: The Altruists; The Hypnoglyph; Testament of Andros; Gratitude Gruaranteed; Rustle of Wings; The Other Tiger; Civilized; Stickeney and the Critic; The Word; Hermit on Bikini; Jezebel; D. Pl from Tomorrow; Potential; Eye for Iniquity,,???
30336377998,Bulfinch's Mythology: The Age of Fable.,,???
30336560867,"WEIRD TALES: September, Sept. 1949",1949,???
30336816114,"I'm Nobody! Who Are You? (02) by Dickinson, Emily [Mass Market Paperback (2002)]",,???
30337235707,Conan the Swordsman,,???
30337236849,"AGE OF FABLE, THE, or BEAUTIES OF MYTHOLOGY, A New, Revised and Enlarged Edition",1898,???
30337393588,The Oakdale Affair,1974,???
30337394555,The Mad King,1975,???
30337394556,The Lad and the Lion,1978,???
30337397226,Escape on Venus,1970,???
30337423703,The Shuttered Room and Other Tales of Horror,1971,???
30337487973,Robinson Crusoe (High-fliers),,???
30337574502,Columbus and the New World,1957,???
30337730390,The nameless,,???
30337946498,Black Amazon of Mars and Other Tales from the Pulps,,???
30338970628,The Stories and Fables of Ambrose Bierce,,???
30339141978,Hounds of Skaith (Sphere science fiction),,???
30339252409,Tarzan and the Foreign Legion,,???
30339253816,Great Detective Stories (Watermill Classics),,???
30339267147,A Christmas Carol and Other Holiday Tales,,???
30339328685,Graphic Classics Gothic Classics,,???
30339361477,The Hounds of Skaith,1974,???
30339603406,The Moving Finger (DELL #5861),1942,???
30339991946,The devil's dictionary,1978,???
30341594685,NORTHANGER ABBEY REPRINT Edition,,???
30341786924,An Occurrence at Owl Creek Bridge,,???
30341841626,The Warlord of Mars,,???
30341991515,The Collected Writings of Ambrose Bierce (With an introduction by Clifton Fadiman),1963,???
30342544214,NO LIMITS,1964,???
30342789053,Great Detective Stories (Watermill Classics),,???
30342961175,The Age of Fable or Stories of Gods and Heroes,1855,???
30343295167,"HISTORY OF ARABIA AND ITS PEOPLE, Containing An Account of the Country and Its Inhabitants, the Life and Religion of Mohammed, the Conquests, Arts, and Literature of the Saracens, the Caliphs of Damascus, Bagdad, Africa, and Spain, the Modern Arabs, the",1852,???
30343440325,CliffsNotes Pride and Prejudice,,???
30343892169,Men of the Deep Waters,,???
30343910155,Tarzan and the Lost Empire,,???
30344056021,The Age of Fable,1950,???
30344062482,Tarzan and the Lost Empire,,???
30344282644,The Complete Sherlock Holmes vol 1 only,,???
30344285955,"Collected Poems Of Emily Dickinson[Hardcover,1986]",,???
30344598588,"26 MYSTERY STORIES OLD AND NEW BY TWENTY AND SIX AUTHORS",1927,???
30344698912,Thongor Fights The Pirates Of Tarakus (Berkley X1861;,1970,???
30345051507,The Last Voice They Hear,,???
30345408875,"The Land That Time Forgot (Ace Science Fiction Classic, F-213)",,???
30345423636,Great Expectations (A Stepping Stone Book),,???
30345446183,The Complete Sherlock Holmes Volume Two,,???
30345717147,Pride and Prejudice (Dover Thrift Editions),,???
30345939527,The Book of Skaith Trilogy Set of 3 Paperbacks 1. The Ginger Star 2. The Hounds of Skaith 3. The Reavers of Skaith,1976,???
30346004339,The Book of the Dead,,???
30346046203,For Women: Pocket Monologues from Shakespeare,,???
30346129427,The Book of the Dead,,???
30346436952,Bulfinch's Mythology: The Age of Fable / The Legends of Charlemagne / The Age of Chivalry (Laurel Classic),1967,???
30346660092,The Complete Poems of Emily Dickinson,1976,???
30346756891,Atlantis: The Antediluvian World. A Modern revised Edition Edited by Egerton Sykes.,,???
30346991183,Heroic War Stories,,???
30347327319,THE AGE OF FABLE or Beauties of Mythology.,,???
30347375805,Tarzan The Terrible [Tarzan 8],,???
30347379347,The Sword of Rhiannon,1979,???
30347680405,Classic Ghost Stories (Dover Thrift Editions),,???
30347698425,Trumps of Doom - the Sixth Amber Novel,,???
30348963012,Tarzan of the Apes : Edgar Rice Burroughs Authorized Edition,,???
30349086940,STRANGE PORTS OF CALL,1948,???
30349208601,"Thongor at the End of Time [Mass Market Paperback] Carter, Lin",1979,???
30350245801,Beachheads in Space,,???
30350286961,J.C. Christensen - Dagbøger 1900-09.,,???
30350476374,Harrigan's file by August Derleth (First Edition),1975,???
30351242890,Book of the Dead: The Hieroglyphic Transcript of the Papyrus of ANI,1960,???
30351804504,The Hounds of Skaith,1974,???
30351875071,"Thongor and the Wizard of Lemuria (Thongor, Book 1)",1969,???
30351965433,Ghost and Horror Stories of Ambrose Bierce,1964,???
30351970942,The Ginger Star (Skaith #1),1974,???
30351985155,Terror by Night (Wordsworth Mystery & Supernatural) (Tales of Mystery & the Supernatural),,???
30352015316,"Emerson, Our Contemporary.",1970,???
30352081882,Concord and the Merrimack (Masterworks of Literature),,???
30352084871,The First Men in the Moon,,???
30352107844,Great Expectations (Great Illustrated Classics),,???
30352115283,Fluent in Fantasy: A Guide to Reading Interests (Genreflecting Advisory Series),,???
30352119041,Tarzan And The Leopard Men,,???
30352489039,The Ginger Star - Eric John Stark Series,1976,???
30352810120,Illustrated Sherlock Holmes Treasury,,???
30352887123,The Secret Of Sinharat,1964,???
30352890913,People Of The Talisman,1964,???
30352956107,SKULL SESSION; Alfred Hitchcock's,1968,???
30353098740,Tarzan Triumphant,1975,???
30353333565,EGYPTIAN LANGUAGE. Easy Lessons in Egyptian Hieroglyphics,,???
30353537536,Mr. Fairlie's Final Journey,1968,???
30354314363,The Importance of Being Earnest and Other Plays: Salome; Lady Windermere's Fan (Signet Classics),,???
30354638602,"Flashing swords! by Carter, Lin",,???
30354833649,The Shield of the Valiant by August Derleth,1945,???
30354838327,Planets of Wonder: A Treasury of Space Opera by Terry Carr (ed.),1976,???
30354843985,Planets of Wonder: A Treasury of Space Opera by Terry Carr (ed.),1976,???
30354845000,A Shadow in the Glass by August Derleth,1964,???
30354962551,People of the Talisman / The Secret of Sinharat,1964,???
30354980005,"The Age of Fable or the Beauty of Mythologies (Volumes 1,2,3)",1919,???
30355093984,People That Time Forgot,,???
30355149050,Gulliver's Travels (The Great Writers Library),,???
30355307467,The Chronicles of Solar Pons - #2 The Adventures of Solar Pons - London's Most Redoubtable Hero Since Sherlock Holmes Returns in More Spellbinding Adventures,1974,???
30355552620,Tarzan: In Easy-to-Read Type (Children's Thrift Classics),,???
30355554727,ADHD with Comorbid Disorders: Clinical Assessment and Management,,???
30356009620,"Lonely Planet Russia, Ukraine and Belarus : Travel Survival Kit",,???
30356171928,I Am a Barbarian,,???
30356298768,"The Age of Fable, or Stories of Gods and Heroes",1958,???
30356302375,History of the Revolutions in Europe from the Subversion of the Roman Empire,1849,???
30356362668,Robinson Crusoe (Saddleback Classics),,???
30357074349,"Jungle Tales of Tarzan (Tarzan #6) (Vintage Ballantine, U2006)",,???
30357111963,THE ADVENTURE OF THE UNIQUE DICKENSIANS,1968,???
30357161682,Poemas,,???
30357267247,"Thoreau: People, Principles and Politics (American Century Series, Ac64)",,???
30357374290,Alfred Hitchcock's Daring Detectives: Exciting Stories of Great Feats of Detection,1969,???
30357467437,The Galactic Breed/Conquest of the Space Sea,1955,???
30357499205,"Father, We Thank You",,???
30357561497,Tolkien Look Behind,,???
30357620564,Survivor and Others,,???
30357684266,An Eye for An Eye by Leigh Brackett (First Edition),1957,???
30357780594,In the Green Star's Glow,1976,???
30357928800,MR. FARLIE'S FINAL JOURNEY,1968,???
30358493372,Lectures Accompanied By three Photographs of Donnelly,,???
30358520547,Stranger at Home,1900,???
30358748525,Spc Simplified: Practical Steps to Quality,,???
30358759255,Hallowe'en Party,,???
30358789301,Nemesis,1971,???
30358800470,"American Wit and Humor (The Pocket University, Volume VII, Parts I and II)",,???
30359711706,Atlantis: The Antediluvian World -- Illustrated,1910,???
30359715131,Egyptian Magic,1971,???
30359724321,Bulfinch's Mythology: The Age of Fable' the Age of Chivalry; Legends of Charlemagne -- Illustrated,1979,???
30359727277,The Ginger Star 1 - First 1st Printing,1974,???
30359733132,Alpha Centauri - Or Die! / Legend of Lost Earth -- Ace Double F-187,1963,???
30359738117,The Book of Skaith: The Adventures of Eric John Stark,1976,???
30359761004,"Bulfinch's Mythology: Including the Complete Texts of the Age of Fable, The Agle of Chivalry, Legends of Charlemagne (Illustrated Edition)",1979,???
30359762770,The Age of Fable or Beauties of Mythology (Volume II: Stories of Gods and Heroes [Continued]),1914,???
30359763683,The Best of Edmond Hamilton,1977,???
30359767863,The Age of Fable or Beauties of Mythology,1914,???
30359770353,"The Age of Fable, or Beauties of Mythology (Volume IV: Legends of Charlemagne)",1914,???
30359777960,"Bulfinch's Mythology: The Age of Fable, The Age of Chivalry, Legends of Charlemagne",1970,???
30359822291,Diabolical Definitions,1970,???
30361157378,The Age of Fable or Beauties of Mythology Volume III,1913,???
30361159085,"The age of fable, or, Beauties of mythology",1914,???
30361223630,The Hounds of Skaith,1974,???
30361248792,"Portals of tomorrow : the best tales of science fiction, and other fantasy",1954,???
30361289308,"The Casebook of Solar Pons (Solar Pons, No 4)",1975,???
30361293933,The Reminiscences of Solar Pons (#5),1961,???
30361293934,"The Memoirs of Solar Pons (The Solar Pons Series, No 3)",1978,???
30361379695,The Complete Poems of Emily Dickinson,1960,???
30361383506,Three Times Infinity (Gold Medal d1324),1963,???
30361581826,Atlantis: The Antediluvian World: A Modern Revised Edition,1949,???
30362112175,Great Expectations,,???
30362456248,Great Expectations,,???
30362659750,"Bulfinch's Mythology, Illustrated: The Age of Fable, The Age of Chivalry, Legends of Charlemagne",1978,???
30363412655,The Splendour That Was Egypt (Sidgwick & Jackson Great Civilizations Series),1963,???
30363873066,Pirates of Venus,,???
30364264343,The Age of Fable or Beauties of Mythology.,,???
30364305215,Complete Poems of Emily Dickinson Controlled Release,,???
30364452564,Father Marquette and the Great Rivers,1955,???
30364456258,St. Ignatius and the Company of Jesus,1956,???
30364548410,Atlantis: the Antediluvian World / A Modern Revised Edition,1962,???
30364940708,Fantastic Universe Science Fiction Volume 1 Number 1 for June - July 1953,1953,???
30365055909,"And You, Thoreau!",1944,???
30365241141,The Devil's Dictionary,1971,???
30365270009,Walden West,,???
30365538415,Sherlock Holmes Volume 1: A Study in Scarlet,,???
30365542322,A Christmas Carol.,,???
30365575189,Bulfinch's Mythology: 2 (A Studio book),1979,???
30365664481,Brave Horse: The Story of Janus,,???
30365693873,Atlantis: The Antediluvian World,1901,???
30365693875,Atlantis: The Antediluvian World,1882,???
30365831615,"FANTASTIC STORY: March, Mar. 1953",1953,???
30366047650,ATLANTIS: THE ANTEDILUVIAN WORLD.,1882,???
30366404359,Country Places,1965,???
30366452793,PERSUASION by JANE AUSTEN,,???
30366545047,Selected Poems & Letters of Emily Dickinson,1959,???
30366598171,The Long Tomorrow,1955,???
30366598500,"The Dolphins of Altair (Dell SF, 2079)",,???
30366615202,Dombey and Son (Modern Library Classics),,???
30366941194,The Ginger Star (Skaith #1),,???
30367168499,The Starmen of Llyrdis,1975,???
30367354444,In the Midst of Life,1927,???
30367514525,Legends of Charlemagne,1111,???
30367537375,TOPS IN SCIENCE FICTION: Fall 1953,1953,???
30367742933,Dracula (Barnes & Noble Classics),,???
30367928401,The Long Tomorrow,1955,???
30368024528,Dead Man's Folly (Pocket Book),,???
30368696281,POEMS THAT THAT TOUCH THE HEART,1963,???
30368858372,Preussentum Und Sozialismus,,???
30368911828,Flashing Swords! No. 1,,???
30369176851,"Under the Green Star (Green Star, Bk. 1)",1972,???
30369202793,Experience And Expression,,???
30369260080,Preussentum Und Sozialismus,,???
30369276457,"Bulfinch's Mythology: Includes The Age of Fable, The Age of Chivalry & Legends of Charlemagne (Modern Library (Paperback))",,???
30369609049,The Mummy,1974,???
30370090423,The Empire Strikes Back Notebook,,???
30370142653,The Master Mind Of Mars - The Sixth Book Of The Famous Maritan Series,,???
30370313372,Lost World of Time,1969,???
30370317074,Beyond the Gates of Dream,1969,???
30370358007,"At the Earth's Core (Ace SF Classic, F-156)",1961,???
30370378663,FAMOUS FANTASTIC MYSTERIES Feb. 1948,1948,???
30370975620,Life Of Our Lord,1664,???
30370986346,The Shadow in The Glass,1964,???
