"Book_ID","Title","Release_Date","Location"
2826479,BRAVE HORSE - THE STORY OF JANUS,1968,???
5789790,THE COMING OF THE TERRANS,1967,???
5789908,THONGOR AGAINST THE GODS,1967,???
5789909,THE WARRIOR OF WORLD'S END,1974,???
7838748,"Concord Rebel, a Life of Henry David Thoreau",1962,???
8012255,"THE AGE OF FABLE; or, Stories of Gods and Heroes. Introductory Essay by Dudley Fitts. Illustrated by Joe Mugnaini.",1958,???
8139693,Atlantis The Antediluvian World A Modern Revised Edition,1949,???
8150199,Report of the Pine Land Investigating Committee to the Governor of Minnesota.five thousand copies ordered printed for the use of the legislature,1895,???
8150205,Contested election case of Ignatius Donnelly versus William D. Washburn. contestants brief [cover title],1879,???
8915760,Countryman's Journal,1963,???
9422999,Thrilling Wonder Stories Vol.1 No.3 British Edition June 1950 (The Lure of Polaris; The Lake of the Gone Forever; Cold War),1950,???
10374155,Harrigan's File,1975,???
11033829,Countryman's Journal.,1963,???
11184767,"Atlantis: The Antediluvian World, A Modern Revised Edition",,???
11941360,GHOST AND HORROR STORIES OF,1964,???
13230268,THE SECRET OF SINHARAT/PEOPLE OF THE TALISMAN,1964,???
13230271,THE CHRONICLES OF SOLAR PONS,1974,???
16303999,The Chronicles of Solar Pons,1973,???
17722731,THE OUTER REACHES Van Vogt Asimov Sturdeon Simak Bradbury,,???
17722732,BEACHHEADS IN SPACE asimov,,???
18232751,The sonnets of Shakespeare: an essay. Printed for private distribution,1859,???
18455449,WALDEN WEST,1961,???
18968066,FLASHING SWORDS #3: WARRIORS AND WIZARDS,1976,???
19505856,Atlantis: The Antedilluvian World.,1949,???
19559446,THE BEST OF EDMOND HAMILTON,1966,???
20313393,KING KULL,1972,???
21419752,WORLDS OF TOMORROW Clarke Leiber Tenn Sturgeon Derleth,,???
21726951,Egyptian Language: Easy Lessons in Egyptian Hieroglyphics with Sign List,1970,???
22501613,FLASHING SWORDS! #4: BARBARIANS AND BLACK MAGICIANS,1977,???
23347917,THE COMING OF THE TERRANS gga,,???
24246484,"The Dwellers on the Nile: The Life, History, Religion and Literture of the Ancient Egyptians",1977,???
25402700,THE ATLANTIC MONTHLY: DECEMBER 1935,,???
25845949,Harrigan's File,1975,???
25847721,Age (The) of fable or Stories of Gods and Heroes,1958,???
27059037,"Atlantis: the antediluvian world.* A modern revised edition, edited by Egerton Sykes",1949,???
29114167,THONGOR OF LEMURIA,1966,???
29391816,The Laurel Poetry Series Selected,1966,???
29942480,Return To Walden West,1970,???
29948319,Sardonic (The) Humor of Ambrose Bierce,1963,???
30921062,Thongor at the End of Time,1971,???
32283616,The Man Who Loved Mars,1973,???
32484944,LOST WORLD OF TIME,1969,???
32484945,THONGOR IN THE CITY OF MAGICIANS,1966,???
35134460,Restless Is The River.,1939,???
35291455,The City Outside the World,1977,???
40813675,The Warrior of World's End,1974,???
42478705,Bulfinch's Mythology The Age of Fable,1968,???
46718605,The Immortal of World's End,1976,???
49405394,The Best of Leigh Brackett,,???
49405476,The Year's Best Fantasy Stories: 2,,???
49405477,The Year's Best Fantasy Stories: 3,,???
49589213,THE SECRET OF SINHARAT/PEOPLE OF THE TALISMAN,1964,???
50349898,Tower at the Edge of Time,1969,???
51727652,Tolkien: A Look Behind the Lord of the Rings,1975,???
52767188,TOLKIEN: A Look Behind The Lord Of The Ring,1974,???
52958569,Flashing Swords! #4,1977,???
53288257,"Legends of Charlemagne; or, Romance of the Middle Ages",1863,???
54347660,OUTWORLDER,1971,???
57341513,Restless is the River,1939,???
57369327,Tolkien: The Look Behind The Lord of the Rings,1976,???
57960667,ATLANTIS: THE ANTEDILUVIAN WORLD,1949,???
58083459,The Reavers of Skaith,1976,???
59118317,The Mummy.,1974,???
59323711,Flashing Swords! #4 Barbarians and Black Magicians,,???
59774732,Wisconsin Country-A Sac Prairie Journal,1965,???
59868080,The Warrior of World's End,1974,???
59876390,Atlantis The Antediluvian World,1949,???
60871419,"PEOPLE OF THE TALISMAN , THE SECRET OF SINHART",1964,???
60883878,The mummy.,1974,???
61312364,Time to Come,1965,???
62351857,Flashing Swords! #4,1977,???
62351863,Flashing Swords! #2,1973,???
62486293,Portals of Tomorrow,1954,???
63847237,Father Marquette and the Great Rivers,1955,???
64344236,The Mummy,,???
65620710,TIME TO COME,1969,???
65621722,ALPHA CENTAURI OR DIE! LEGEND OF LOST EARTH,1963,???
65673800,THE BOOK OF SKAITH; THE ADVENTURES OF ERIC STARK,1976,???
65853181,TOLKIEN: A LOOK BEHIND THE LORD OF THE RINGS. (ballantine # 27539).,1978,???
66711815,Tent Show Summer,1963,???
69200906,THE OFF-WORLDERS/THE STAR MAGICIANS,1966,???
69711061,The Hounds of Skaith 2,1974,???
70485757,Atlantis: The Antediluvian World,1949,???
71652978,FAVORITE POEMS OF EMILY DICKINSON,1978,???
71936075,Hawk on the Wind: Poems.,1938,???
71946373,Return to Walden West.,1970,???
71946375,Walden West.,1961,???
71951675,Emerson Our Contemporary.,1970,???
71954541,Egyptian Magic.,1958,???
71991916,Bulfinch's Mythology.,,???
72195263,ATLANTIS: The Antediluvian World,1949,???
72217938,New Poetry out of Wisconsin.,1969,???
72585199,Mummy (The),1974,???
73525339,"Bulfinch's Mythology - The Age of Fable, The Age of Chivalry, Legends of Charlemagne",1979,???
74267172,Best Supernatural Stories of H.P. Lovecraft,1945,???
74583242,THE GREAT CRYPTOGRAM Frances Bacon's Cipher in The So-Called Shakespeare Plays,1888,???
75161672,SWORDS AGAINST TOMORROW,1970,???
75326809,The Hounds of Skaith,,???
76645772,Amazing Stories Vol.1 No.7,1960,???
76653778,Amazing Stories No.6,1960,???
76653798,Fantastic Adventures No.4,1960,???
76653800,Fantastic Adventures No.6,1960,???
76653804,Fantastic Adventures No.10,1960,???
76738359,"Emerson, Our Contemporary",1970,???
77404867,The Age of Fable or Beauties of Mythology,1898,???
80167542,Great Short Novels of Adult Fantasy Volume II,1973,???
80381323,Harrigans File,1975,???
80432926,Portals of Tomorrow,,???
80650208,The Reavers of Skaith,1976,???
81001641,Flashing Swords #4: Barbarians and Black Magicians,1977,???
81080618,"TUTANKHAMEN: Amenism, Atenism and Egyptian Monotheism",,???
81084402,ATLANTIS: The Antediluvian World,1949,???
81958212,"H P Blavatsky Collected Writings, 1874-1878, Volume One",1966,???
83207534,"BARBARIAN OF WORLD'S END, THE (paperback)",1977,???
83553429,Final Harvest,1961,???
83694333,BEACHHEADS IN SPACE,1957,???
83937837,The Trojan War,1957,???
86167820,Final Harvest - Emily Dickinson's Poems,1961,???
86460727,Atlantis: The Antedivulian World--a Modern Revised Edition,1949,???
88124996,Return to Walden West,1970,???
88289157,Harrigan's File,1975,???
88327549,THE QUEST OF KADJI,1972,???
88327553,THONGOR AND THE DRAGON CITY,1976,???
88327561,THE WARRIOR OF WORLD'S END,1974,???
92560776,Flashing Swords! #1,1973,???
93651659,Lost World of Time,1969,???
93651687,Thonger at the End of Time,1968,???
93782038,Charlemagne or Romance of the Middle Ages,1896,???
94519855,The Wizard of Lemuria,1965,???
94519859,The Man Who Loved Mars,1973,???
94519861,Sky Pirates of Callisto,1973,???
94682126,EGYPTIAN LANGUAGE Easy Lessons in Egyptian Hieroglyphics,1963,???
94990121,Flashing Swords! #1,1973,???
95933827,The Warrior of World's End,1974,???
95982329,Thongor Fights the Pirates of Tarakus,1970,???
96377151,Flashing Swords! #2,1973,???
96613293,Constable's Miscellany Vol. XXXV History of the Revolutions in Europe Vol. III [volume 3 only].,1828,???
96728543,"Zarkon, Lord of the Unknown in Invisible Death, A Case From The Files of Omega",1975,???
96728547,"Zarkon, Lord Of The Unknown In The Volcano Ogre, A Case From The Files of Omega",1976,???
97143634,The Nemesis from Terra,1961,???
98016620,Bolts of Melody: New Poems of Emily Dickinson,1945,???
98082467,THE SWORD OF RHIANNON,1967,???
98082475,LEGEND OF LOST EARTH/ALPHA CENTAURI OR DIE!,1963,???
98716627,The Nemesis from Terra,1961,???
99434603,TIME TO COME Science Fiction Stories of Tommorrow,1965,???
99706731,Egyptian Language,1966,???
104346672,ORBIT SCIENCE FICTION #1,1954,???
104810526,"100 Books by August Derleth",1974,???
104990066,Sardonic Humor of Ambrose Bierce,1963,???
105112880,"The Age of Chivalry, Or Legends of King Arthur",1884,???
107350406,"Tutankhamen : Amenism, Atenism & Egyptian Monothesim",,???
108755552,Tarzan #7: Tarzan the Untamed,1972,???
114761838,"How in the Night the Wind' - first publication in Decade, Vol. 2, No. 2",1940,???
118080872,"Die Geheimlehre. Das heilige Buch der Theosophischen Brüderschaft. Herausgeber und Übersetzer: Dr. Victor Eckert.,",1958,???
118335126,"AGE OF FABLE, THE: STORIES OF GODS AND HEROES",,???
119929444,NEW WORLDS FOR OLD,1963,???
119956640,TIME WAR,1974,???
121220168,Bulfinch's Mythology,1948,???
122559422,FEAR NO EVIL (aka THE TIGER AMONG US),1960,???
125079360,The Book Of The Dead.,1960,???
126034900,The Hills Stand Watch,1960,???
126617262,TIME TO COME,1963,???
127092684,"Bulfinch's Mythology, Age of Fable, Age of Chivalry, legends of Charlemagne",1913,???
129127630,Bolts Of Melody,1945,???
132132764,Ignatius Donnelly: The Portrait of a Politician (with account of his work on Atlantis),1962,???
132528312,Favorite Poems of Emily Dickinson,1978,???
133460406,Doctor Huguet.,1891,???
137943804,BULFINCH'S MYTHOLOGY: The Age of Fable. With a Foreword by Robert Graves,1968,???
140933246,The Lost Continent,1972,???
145641248,MAGAZINE OF HORROR #24,1968,???
149786114,Charlemagne or Romance of the Middle Ages,1896,???
152665796,People of the Talisman and The Secret of Sinharat,1964,???
153158340,A Wisconsin Harvest,1966,???
153620084,"Night's Yawning Peal 8 Tales of Horror and Possession by Masters of the Macabre, Including The Case of Charles Dexter Ward' by H.P. Lovecraft",,???
155172594,Beyond the Gates of Dream,1969,???
155972280,SHE BEING DEAD YET SPEAKETH And Twelve Other Articles,1959,???
155975488,ATLANTIS The Antediluvian World,1950,???
155975492,ATLANTIS The Antediluvian World,1950,???
157218794,Bright Journey,1940,???
157948480,THE GREAT CRYPTOGRAM:; Francis Bacon's cipher in the so-called Shakespeare plays,1888,???
161605164,"Scandinavia, Ancient and Modern; Being a History of Denmark, Sweden, and Norway: Comprehending a Description of these Countries. . . 1-2.",1838,???
162989878,"Mythology of Greece and Rome, with Eastern and Norse Legends",1962,???
164668252,Tolkien: a Look behind 'the lord of the rings',1978,???
167542746,Bulfinch's Mythology,1968,???
167931972,Bolts of Melody: New Poems of Emily Dickinson,1945,???
168057808,PEOPLE OF THE TALISMAN/THE SECRET OF SINHARAT.,1964,???
168392700,The Ginger Star (Eric John Stark),1976,???
172778114,Empire of Fur Trading in the Lake Superior Region,1953,???
174123078,BEST SUPERNATURAL STORIES OF H. P. LOVECRAFT,1945,???
178644568,The Age of Fable,1942,???
179316482,THE ROSETTA STONE.,1955,???
181882894,"The Age of Chivalry and Legends of Charlemasgne, or Romance of the Middle Ages",1962,???
184291816,BULFINCH'S MYTHOLOGY: THE AGE OF FABLE; THE AGE OF CHIVALRY; LEGENDS OF CHA RLEMAGNE (COMPLETE IN ONE VOLUME),1913,???
184854492,Tarzan the Terrible,1969,???
186032294,"Favorite Poems of Emily Dickinson. by Dickinson, Emily .",,???
186741428,Black Legion of Callisto,1975,???
186741430,Sky Pirates of Callisto,1975,???
188965348,TOLKIEN : A LOOK BEHIND THE LORD OF THE RINGS,1978,???
189472654,Tolkien: A Look Behind the Rings,1969,???
196947339,The Wizard of Lemura,1965,???
196981282,A House Above Cuzco,1969,???
197729822,Ragnarok : The Age of Fire and Gravel,1970,???
198023592,Tower at the Edge of Time,1972,???
198587381,THE REAVERS OF SKAITH,1976,???
200489648,LEGENDS OF CHARLEMAGNE,,???
200669937,WEIRD TALES MAY 1949,1949,???
200670575,WEIRD TALES JANUARY 1949,1949,???
202545686,Bulfinch's Mythology,1968,???
202569880,RAGNAROK: THE AGE OF FIRE AND GRAVEL,1883,???
203139294,"A General Introductory Guide to the Egyptian Collections in the British Museum,",1930,???
203652682,Columbus and the New World,1957,???
203987274,"Scandinavia, Ancient and Modern; Being A History of Denmark, Sweden and Norway: Comprehending A Description of These Countries; An Account of the Mythology, Government, Laws, Manners and Institutions of the Early Inhabitants; and of the Present State of",1838,???
204769205,The Year's Best Fantasy Stories 3,1977,???
204909201,"The Golden Bottle Or, the Story of Ephraim Benezet of Kansas",1893,???
205518404,BEACHHEADS IN SPACE,1957,???
206516948,Fantastic Stories Magazine Vol.5 No.2 March 1953 (Shadow Over Mars; The Best Laid Scheme; Baby Face; Hero; The War of the Weeds; Death Ship; Too Bad You Died),1953,???
206691317,Sky Pirates of Callisto,1974,???
206835290,Abridgement of the Secret Doctrine,1968,???
207138180,"AND YOU, THOREAU!",1944,???
207666135,People of the Talisman / The Secret of Sinharat,1964,???
208647507,"Great Cryptogram, The: Francis Bacon's Cipher in the So-Called Shakespeare Plays",1888,???
210090564,The Country of the Hawk,1952,???
210616762,"History of Arabia, Ancient and Modern: Containing a Description of the Country An Account of its Inhabitants.the Conquests, Arts, and Literature of the Saracens, The Caliphs of Damascus, Bagdad.Government and Religious Ceremonies of the Modern Arabs.Ins",1834,???
214566439,The Age of Fable or Stories of Gods and Heroes,1958,???
215104607,WALDEN WEST,1961,???
216354280,The Best of Edmond Hamilton,1977,???
219241498,THE OFFWORLDERS/THE STAR MAGICIANS,1966,???
219907698,The Book of the Dead,1960,???
224140372,BULFINCH'S MYTHOLOGY,1966,???
224408800,The Age Of Fable Or The Beauties Of Mythology,1942,???
224743286,THONGOR AND THE WIZARD OF LEMURIA,1976,???
225137188,The Mummy,1974,???
226751724,Mad Empress of Callisto,1975,???
226751730,Thongor and the Wizard of Lemuria,1976,???
228467616,The Shadow in the Glass,1964,???
230905570,Bright Journey,1940,???
231229984,The Best of Leigh Brackett,1977,???
241899954,"Emerson, Our Contemporary",1970,???
242855190,"Agatha Chrisie, Third Girl",1968,???
242855194,"Agatha Chrisie, Towards Zero",1947,???
246952112,TIME TO COME,1958,???
247498168,Pullucidar,1972,???
248100776,The Gods of the Egyptians Volume 2,1969,???
248222574,Tolkien: A Look Behind the Lord of the Rings,1970,???
248689686,Time to Come,1964,???
249091258,RESTLESS IS THE RIVER,1939,???
252703162,The Thief of Thoth & Others Shall be Born,1968,???
254659082,The Adventure of the Red Leech,1966,???
255080720,FAR BOUNDARIES,1965,???
256397212,THE WIZARD OF LEMURIA,1965,???
258213710,"Age of Chivalry or, King Arthur and His Knights",1900,???
259393306,Mythology,1963,???
259427130,TOLKIEN: A LOOK BEHIND THE LORD OF THE RINGS,1969,???
261681624,Ragnarok: The Age Of Fire And Gravel.,1885,???
263925654,People of the Talisman The Secret of Sinharat Ace Double M-101,1964,???
268903016,"Scandinavia, Ancient And Modern; Being A History of Denmark, Sweden, And Norway Etc. In Two Vols",1838,???
273259618,Beyond the Gates of Dream,1969,???
275352520,BEACHHEADS IN SPACE,1964,???
275352524,THE TIME OF INFINITY,1963,???
275352526,WORLDS OF TOMORROW,1963,???
276708030,Flashing Swords! *4: Barbarians and Black Magicians,1977,???
277299648,The Age of Fable,1942,???
284059618,Egyptian Religion: Egyptian Ideas of the Future Life,1959,???
284622700,The Poets' Log Book. Fifth Voyage. (Vol.2. No.1). An Anglo-American Quarterly of Verse. (Poetry Editor: V. W. Hess).,1947,???
284622706,"The Poets' Log Book. Third Voyage. Spring 1947. (Vol.1, No.3). A Quarterly of Verse. (Poetry Editor: V. W. Hess).",1947,???
286376596,THE SECRET OF SINHARAT / PEOPLE OF THE TALISMAN,1964,???
286507092,In The Midst of Life,1961,???
292831282,ATLANTIS: THE ANTEDILUVIAN WORLD,1949,???
293243334,The Hound of the Baskervilles,1967,???
295444012,The Chronicles of Solar Pons.,1973,???
297204242,The Year's Best Fantasy Stories: 2,1976,???
298886686,Walden West,1961,???
300673692,THE BIG JUMP,1955,???
300775032,The Metal Monster,1976,???
303692372,The Age of Fable,1942,???
305678856,THONGOR AND THE PIRATE CITY,1970,???
308245304,The Ginger Star (Eric John Stark #1),1974,???
308245306,The Hounds of Skaith (Eric John Stark #2),1974,???
308245308,The Reavers of Skaith (Eric John Stark #3),1976,???
308245316,The Big Jump,1976,???
308391950,THE MAGAZINE OF FANTASY AND SCIENCE FICTION JULY 1953,1953,???
308405492,FICTION #54,,???
308848486,"Atlantis - The Antediluvian World, A Modern Revised Edition",1949,???
309161378,The Mummy,1974,???
312114590,Astonishing Stories 1943 Vol. 4 # 3 February,1943,???
312224938,EGYPTIAN LANGUAGE Easy Lessons in Egyptian Hieroglyphics with Sign List,1966,???
313984490,Egyptian Language; Easy Lessons in Egyptian Hieroglyphics with Sign List,1966,???
316371282,The Shadow in the Glass,1964,???
316920310,The Age of Fable,1965,???
327683596,TALES OF SOLDIERS & CIVILIANS.,1943,???
327939150,Invisible Death,1975,???
331786960,Far Boundaries,1967,???
332500200,Doomsman / The Thief of Thoth,1972,???
333919388,THE BEST OF EDMOND HAMILTON,1977,???
334872266,Pengevaesen Og finanser; Grundbod for Studiekredse,1941,???
344406900,A Boy's Way,1947,???
346777536,The Big Jump,1955,???
355605560,The Shadow in the Glass,1964,???
362354714,The GINGER STAR,1974,???
362354844,The COMING Of The TERRANS,1967,???
363677716,"THE SATANISTS; THE SATANIS MASS, THE SANCTUARY, ANCIENT SORCERIES, THE FESTIVAL, THE WATCHER FROM THE SKY, THE BLACK MOUNTIAN, THE INITIATION, THE BOOK, NO NEWS TODAY, SPAWN OF THE DARK ONE, BLACK MAGIC BATTLE IN THE CHURCH",1972,???
367727694,Bulfinch's Mythology: The Age of Chivalry,1968,???
369221706,Danske topografiske exlibris,1970,???
372101460,CONAN #12- CONAN OF THE ISLES,1968,???
372101494,CONAN # 2 - THE LIBERATOR,1979,???
374012430,FLASHING SWORDS! #2,1974,???
375617382,Der Weg nach Sinharat,1977,???
381789252,THE ARKHAM COLLECTOR,1971,???
381789254,THE ARKHAM COLLECTOR,1971,???
381789256,THE ARKHAM COLLECTOR,1969,???
381789258,THE ARKHAM COLLECTOR,1970,???
381789264,THE ARKHAM COLLECTOR,1971,???
381789266,THE ARKHAM COLLECTOR,1970,???
381789268,THE ARKHAM COLLECTOR,1969,???
386334032,"The Dwellers on the Nile: The Life, History, Religion and Literature of the Ancient Egyptians",1977,???
389426132,The Golden Age of Myth and Legend,1919,???
397458844,Age of Fable or the Beauties of Mythology,1942,???
397777360,The Return of Solar Pons (# 6),1975,???
401064106,FANTASTIC AUGUST 1976,1976,???
401064196,FANTASTIC SEPTEMBER 1966,1966,???
401064296,FANTASTIC OCTOBER 1975,1975,???
403146236,GREAT SCIENCE FICTION #11,1968,???
403146240,SCIENCE FICTION CLASSICS #1,1967,???
408701562,WORLDS OF IF JANUARY-FEBRUARY 1974,1974,???
416768812,THE STARMEN,,???
416818656,TOLKIEN: A LOOK BEHIND THE LORD OF THE RINGS,1969,???
417289862,The Age of Chivalry and Legends of Charlemagne (or Romance of the Middle Ages),1962,???
428174396,"Planet Stories, volume 6, # 9 Winter 1954 - 55 ( Teleportress of Alpha C; The Vanisher; the Grave of Solon Regh; Bottom is Up; the Recluse; Life of a Salesman; the Ultimate Eve; the Vizigraph",1954,???
429337182,A LETTER TO JUDITH,1959,???
434818342,"DEVIL'S DICTIONARY, THE: A SELECTION OF THE BITTER DEFINITIONS OF AMBROSE BIERCE",1958,???
448232470,The A. B. C. Murders.,1976,???
458628568,"History of Arabia, Ancient and Modern. And a Comprhensive View of Its Natural History. Volume 1.",,???
462217850,When the Green Star Calls,1973,???
465116642,From other worlds,1964,???
468970560,"Tutankhamen: Amenism, Atenism and Egyptian Monotheism",,???
500778315,The Icleand Fisherman,,???
500996707,Love Poems,,???
510203926,"The Saint Mystery Magazine 1961 Vol. 15, No. 1 September",1961,???
510434364,"EGYPTIAN LANGUAGE, EASY LESSONS IN EGYPTIAN HIEROGLYPHICS WITH SIGN LIST",1971,???
513196408,"Unusual Variant whiptail lizard, Cnemidophorus gularis AND Reversed Southern Flounder, Paralichthys lethostigma, Gulf of Mexico AND Coumarins from acetylene derivatives AND Edaphic study, Spartina spartinae AND Absorption Toxaphene by activated char",1969,???
516196401,"The Dwellers on the Nile: The Life, History, Religion, and Literature of the Ancient Egyptians",1977,???
523253801,Final Harvest Emily Dickinson's Poems,1961,???
533571267,"The age of fable or beauties of mythology [1855] A new, revised and enlarges edition, edited by J. Loughran Scott [1898]",1915,???
535558563,GINGER STAR,1974,???
541789791,Writing Fiction,1946,???
544088755,"Saturn Science Fiction and Fantasy, July 1957, Vol. 1 #3 (with) The Ordeal of Doctor Trifulgas (Jules Verne)",1957,???
544738311,"THE AGE OF FABLE, OR THE BEAUTIES OF MYTHOLOGY. With Notes, Revisions and Additions by W. H. Klapp and Illustrations by Stanley William Hayter.",1942,???
544738317,THE AGE OF FABLE OR STORIES OF GODS AND HEROES. Introductory Essay By Dudley Fitts. Illustrated by Joe Mugnaini.,1958,???
545240461,"The Golden Bottle Or, the Story of Ephraim Benezet of Kansas",1893,???
546832945,Favorite Poems of Emily Dickinson,1978,???
549661597,Bulfinch's Mythology: The Age of Fable; The Age of Chivalry; Legends of Charlemagne,1979,???
561310790,"Egyptian Language, Easy Lessons in Egyptian Language",1973,???
584218320,The Chronicles of Solar Pons,1973,???
585714459,GINGER STAR,1974,???
585714466,HALFLING AND OTHER STORIES,1973,???
586706972,Fonemsystemet i Ostfynsk - ppa grundlag af dialekten i revninge sogn (with an english summary),1958,???
586795362,The Gods of the Egyptians: Or Studies in Egyptianmythology,1969,???
587410150,The Stories & Fables of Ambrose Bierce,1977,???
589259379,The Hounds of Skaith: Further Adventures of Eric John Stark,1976,???
597298527,Stranger at Home,1946,???
597753487,THE AGE OF FABLE.,1931,???
599227931,COUNTRYMAN'S JOURNAL,1963,???
603131527,Countryman's Journal,1963,???
603144474,The Wind Leans West,1969,???
607648076,Caesar's Column: a Story of the Twentieth Century,1960,???
609409907,The Gold of the Gods,1972,???
609539036,The Outline of Mythology: The Age of Fable; The Age of Chivalry; Legends of Charlemagne,1913,???
616044899,GINGER STAR,1974,???
618303378,The Wind Leans West,1969,???
619688794,For Love of Her,1978,???
621772660,Ylana of Callisto,1977,???
622094803,DAVID COPPERFIELD: ILLUSTRATED CLASSIC EDITIONS by CHARLES DICKENS; MALVINA G. VOGEL (EDITOR),,???
622346719,A Tale of Two Cities,1964,???
624547746,Age of Chivalry or King Arthur and his knights,1900,???
628538837,HOUNDS OF SKAITH,1974,???
632782597,YEAR'S BEST FANTASY STORIES 2,1976,???
633199459,Les hommes stellaires,1974,???
639331154,WALDEN WEST,1961,???
641902420,The Demon in the Mirror (War of the Wizards #1),,???
646683402,The Age of Fable.,1965,???
654046371,Countryman's Journal,1963,???
663419831,JOHN CARTER OF MARS (MARS #11 - GINO D'ACHILLE COVER),1978,???
668694395,GREAT EXPECTATIONS by CHARLES DICKENS; MITSU YAMAMOTO,,???
668798517,Beyond the Gates of Dream; Science Fiction #2,1969,???
679028930,THEY CAME TO BAGHDAD,1960,???
684210019,The Shadow in The Glass,1964,???
685589763,Legends of Charlemagne; or Romance of the Middle Ages,,???
685643996,THONGOR OF LEMURIA,1966,???
693211832,Judge Tenderly of Me - The Poems of Emily Dickinson,1968,???
693244008,COUNTRY GROWTH: Short stories.,1940,???
693433208,GINGER STAR,1974,???
696365455,Egyptian Magic,1971,???
720184571,"13 West Street",1962,???
720784757,H.P. Lovecraft and Others:Tales of the Cthulhu Mythos Volume II,1971,???
724617700,The Mummy: a history of the extraordinary practices of Ancient Egypt,,???
724618007,The Mummy: a history of the extraordinary practices of Ancient Egypt,,???
725518600,Alpha Centauri sehen und sterben,1978,???
725518601,Alpha Centauri sehen und sterben,1978,???
731552263,FLASHING SWORDS #4; BARBARIANS AND BLACK MAGICIANS,1977,???
732859854,"Emerson, Our Contemporary",1970,???
733629620,The Adventure of the Snitch in Time,1954,???
735308510,THE HOUSE ON THE MOUND,1958,???
744252203,The Tale/ The Graphic Summer Number. 1894,1894,???
744381506,GREAT EXPECTATIONS by CHARLES DICKENS,,???
749002592,Red Moon and Black Mountain,1971,???
755646723,Shadow in the Glass,1964,???
758139714,New Worlds for Old,1963,???
758566054,Super Science Stories (CANADIAN) 1942 Vol. 01 # 01 August (FIRST ISSUE): Cross of Mercrux / The Wicked People / Child of the Green Light / Spaceship from Korl / Atrakin and the Man / The Waters Under the Earth / Pendulum,1942,???
758566061,Super Science Stories (CANADIAN) 1944 Vol. 01 # 11 April: His Aunt Thiamin / Cabal / Cube from Space / Nothing / Exile / The Sky Will be Ours / The Hunted Ones,1944,???
758781815,FAR BOUNDARIES,1967,???
759353115,THE ENCHANTRESS OF WORLD'S END,1975,???
760022861,"Tutankhamen: Anenism, Atenism and Egyptian Monotheism",1978,???
760373109,Sherlock Holmes' Greatest Cases,1966,???
760983711,The Survivor & Others,1971,???
761348960,Egyptian Language: Easy Lessons in Egyptian Hieroglyphics With Sign List,1966,???
765765850,BARBARIANS AND BLACK MAGICIANS: FLASHING SWORDS #4 by LIN CARTER (EDITOR),,???
765765851,BARBARIANS AND BLACK MAGICIANS: FLASHING SWORDS #4 by LIN CARTER (EDITOR),,???
767170136,"History of the Revolutions in Europe from the Subversion of the Roman Empire in the West Till the Abdication of Bonaparte from the French of C. W. Koch, Vol 3 Only",1828,???
767192230,The Monk and the Hangman's Daughter,1967,???
770023534,"THRILLING WONDER STORIES (Pulp magazine. February,1950) 'Payment in Full' by Ray Bradbury / 'Spectator Sport' by John D. MacDonald / 'The Voice of the Lobster' by Henry Kuttner.",1950,???
773216652,The Dwellers on the Nile,1977,???
776876776,"If Worlds of Science Fiction Volume 1 #3, July 1952",1952,???
778977190,The Man Without a Planet/Time to Love,1966,???
780275740,Egyptian Language: Easy Lessons in Egyptian Hieroglyphics with Sign List,1978,???
792263721,Dead Man's Folly,1974,???
792263735,Death in the Air,1962,???
794438923,A POCKET FULL OF RYE,1963,???
794446109,"IF Worlds of Science Fiction: April, Apr. 1967 ('The Road to the Rim')",,???
794447540,"IF Worlds of Science Fiction: (March, Mar. /) April, Apr. 1974 ('The Ginger Star')",1974,???
802060872,Ragnarok: The Age of Fire and Gravel,1970,???
804133190,"Næringsretten i Hovedtræk. Industri, Haandværk og Handel. Tredje Udgave.",,???
